"ID","DOI","Title","Authors","Year","Source.Title","Volume","Issue","Abstract","Author.Keywords","Scopus.Keywords","WOS.Keywords","Source"
357,"10.1136/bmjopen-2020-039394","Effect of particulate matter exposure on patients with COPD and risk reduction through behavioural interventions: the protocol of a prospective panel study","Park, S; Ra, SW; Kang, SY; Kim, HC; Lee, SW",2020,"BMJ OPEN","10","11","Introduction Patients with chronic obstructive pulmonary disease (COPD) are vulnerable to particulate matter (PM) exposure which can increase acute exacerbations and hospitalisation. Interventions to avoid PM exposure are important but evidence-based guidance is lacking. This study aims to assess the impact of PM on lung function, quality of life and exacerbations in patients with COPD using a panel design study; it will also provide evidence for interventional measures to reduce harm from PM exposure. Methods and analysis A prospective panel study of patients with COPD aged >= 40 years will be conducted. Patients will be required to have a forced expiratory volume in one second <80% of the predicted value at enrolment. A total of 120 patients from three different regions will be enrolled, 60 from the metropolitan area, 30 from an industrialised area and 30 from a clean rural area. Clinical outcomes will be assessed through COPD assessment test scores, the St. George's Respiratory Questionnaire for patients with COPD and pulmonary function testing. Indoor and outdoor PM in the patients' environments will be measured using gravimetric and light scattering platforms. To estimate the individual dose of PM exposure, a time-activity diary, Geographic Information System and land use regression model will be combined in every season for 1 year. The correlation between PM exposure and the health status of patients with COPD will be evaluated. In addition, 40 patients with the lowest score of life behaviour score to reduce environmental PM exposure will be randomised to a control or intervention group, who will receive in-depth education on risk-reducing behaviours. Ethics and dissemination This study was approved by the Institutional Review Board of each site. The participants received comprehensive information and provided informed consent. The result of this study will be discussed in the form of conference presentations and peer-reviewed publications.","chronic airways disease; thoracic medicine; adult thoracic medicine","Adult; Humans; Particulate Matter; Prospective Studies; Pulmonary Disease, Chronic Obstructive; Quality of Life; Risk Reduction Behavior; adult; Article; behavior modification; chronic obstructive lung disease; clinical outcome; controlled study; correlation analysis; disease exacerbation; forced expiratory volume; geographic information system; geography; gravimetry; health status; human; intervention study; land use; light scattering; lung function; major clinical study; panel study; predictive value; prospective study; quality of life; questionnaire; randomized controlled trial; risk reduction; rural area; adverse event; chronic obstructive lung disease; particulate matter; quality of life","OBSTRUCTIVE PULMONARY-DISEASE; AMBIENT AIR-POLLUTION; SHORT-TERM EXPOSURE; ACUTE EXACERBATION; HEART-DISEASE; MORTALITY; HOSPITALIZATIONS; ASSOCIATION; BURDEN; LUNG","WOS"
43,"10.1007/s11356-017-1034-7","Effectiveness of a theory-based mobile phone text message intervention for improving protective behaviors of pregnant women against air pollution: a randomized controlled trial","Jasemzadeh, M; Khafaie, MA; Jaafarzadeh, N; Araban, M",2018,"ENVIRONMENTAL SCIENCE AND POLLUTION RESEARCH","25","7","Health impact of exposure to air pollution is a public health concern. The aim of this study was to investigate an extended parallel process model (EPPM)-based mobile phone text message intervention for improving protective behaviors against air pollution among pregnant women. In this randomized controlled trial (IRCT2016102810804N8), 130 pregnant women were randomly assigned into either experimental or control groups. A valid and reliable questionnaire was used to collect data. Experimental group received mobile phone intervention on a daily basis for 2 months. Control group received usual care, only. Data were analyzed using SPSS 15 applying t test, chi-square, and Wilcoxon and Mann-Whitney U test. Although before intervention, there were no significant differences between different structures of EPPM (P > 0.05), after intervention, there were statistically significant differences between perceived severity, response efficacy, self-efficacy, and protective behaviors between two groups (P < 0.05). Implementing EPPM based-mobile phone intervention could promote protective behaviors against air pollution among pregnant women. The present study might be used as a framework for evidence-based health promotion regarding air pollution risk communication and self-care behaviors. Trial registration: IRCT2016102810804N8.","Extended parallel process model; Air pollution; Pregnancy; Protective behavior; Self-care; mHealth","Adult; Air Pollution; Female; Health Communication; Humans; Iran; Pregnancy; Text Messaging; Young Adult; atmospheric pollution; experimental study; health care; health impact; mobile phone; numerical model; pollution effect; pollution exposure; pregnancy; womens health; adult; air pollution; controlled study; female; human; Iran; medical information; pregnancy; prevention and control; procedures; randomized controlled trial; text messaging; utilization; young adult","RESPIRATORY HEALTH; SELF-EFFICACY; EXPOSURE; CHILDREN; REDUCE; RISK","WOS"
9,"10.1007/BF00477181","Effects of air pollution on the searching behaviour of an insect parasitoid","Gate, IM; McNeill, S; Ashmore, MR",1995,"WATER AIR AND SOIL POLLUTION","85","3","To assess the impact of air pollutants on the population dynamics of herbivores, the effects of pollutants an their natural enemies including predators, parasites, and pathogens must be evaluated in addition to direct effects and indirect effects mediated via the host plant. insect parasitoids are an important group of such natural enemies providing many examples of partial or complete biological control of pest species. This study examined the effects of air pollutants (ozone (O-3), sulphur dioxide (SO2), and nitrogen dioxide (NO2)) on the searching behaviour of insect parasitoids. A series of experiments comprising short-term, closed chamber fumigations of O-3, SO2, and NO2 (100 nl 1(-1)) of the braconid parasitoid (Asobara tabida) and aggregated distributions of its host larvae (Drosophila subobscura) was set up. Analysis of chamber results showed that the proportion of hosts parasitised and the searching efficiency of the parasitoids were both significantly reduced with O-3 fumigation, but not with NO2 or SO2 fumigations. O-3 fumigation reduced percentage parasitism by approximately 10%. Parasitoids were able to avoid patches with no hosts, both in filtered air controls and when exposed to pollutants. However in the O-3 and NO2 treatments they appeared less able to discriminate between different host densities, suggesting that pollutants may interfere with the olfactory responses of the parasitoids. These results indicate the potential for air pollutants, particularly O-3, to negatively influence the searching behaviour of parasitoids, and hence reduce the efficiency of natural enemy control of many pest species.","insects; parasitoid; ozone; nitrogen dioxide; sulphur dioxide; searching behaviour; natural enemy control; Asobara tabida; Drosophila subobscura","","POPULATION; SO2","WOS"
59,"10.1007/s11869-022-01239-3","Effects of covid-induced lockdown on inhabitants' perception of indoor air quality in naturally ventilated homes","Fernández-Agüera, J; Domínguez-Amarillo, S; Campano, MA; Al-Khatri, H",2023,"AIR QUALITY ATMOSPHERE AND HEALTH","16","2","The intensified indoor living during the spring 2020 lockdown, with enhanced user awareness of the prevailing conditions in their homes, constituted a natural stress test for the housing design in place today. Surveys conducted during this period have yielded lessons for designing better intervention strategies for the residential sector, taking into account the systematic morphological and economic limitations of the buildings concerned. These considerations should inform the development of policies and strategies for improving environmental quality compatible with lower residential energy consumption and higher quality of life. This study explores the effect of occupant behaviour on home ventilation and the perception of the impact of indoor air quality on user health before and during lockdown. The method deployed consisted in monitoring environmental variables and conducting user surveys before and after restrictions came into force. The findings showed that prior to lockdown, occupants were unaware of or paid little heed to changes in indoor air quality, failed to perceive stuffiness, and, as a rule, reported symptoms or discomfort only at night during the summer months. During lockdown, however, users came to attach greater importance to air quality, and a greater sensitivity to odours and a heightened awareness of CO2 concentration prompted them to ventilate their homes more frequently. In the spring of 2020, occupants also indicated a wider spectrum of indisposition, in particular in connection with sleep patterns.","Airtightness; Indoor air quality; Occupants' perception; Low-income housing; Ventilation behaviour; Health effects; COVID-19; Lockdown","air quality; COVID-19; environmental quality; housing; indoor air; residential energy; sleep; summer; ventilation","AIRBORNE TRANSMISSION; THERMAL COMFORT; CARBON-DIOXIDE; SLEEP QUALITY; AIRTIGHTNESS; PRODUCTIVITY; ENVIRONMENT; POLLUTION; IMPACTS; COOKING","WOS"
227,"10.1016/j.techsoc.2020.101473","Environmental air pollution management system: Predicting user adoption behavior of big data analytics","Shahbaz, M; Gao, CY; Zhai, LL; Shahzad, F; Khan, I",2021,"TECHNOLOGY IN SOCIETY","64","","This study has a dual purpose: to explore the novel phenomenon of a big data analytics-environmental air pollution (BDA-EAP) management system, and to propose a research model of factors influencing adoption of such a system. The research model is based on task-technology fit (TTF) and unified theory of acceptance and use of technology (UTAUT) concepts. A comprehensive BDA-EAP management system is proposed and the potential adoption speed of such a system evaluated by sending structured questionnaires to the employees of relevant environmental agencies, yielding 412 valid responses, using the structural equation modeling approach. The results of the study predict that factors of TTF including task characteristics and technology characteristics are strong influencers of TTF, and TTF is a strong predictor of the behavioral intention of users to adopt a BDA-EAP management system. The results demonstrated that the combination of TTF and UTAUT is a stronger predictor of behavioral intention than either TTF or UTAUT alone. Furthermore, resistance to change negatively moderates and extrinsic motivation positively moderates the significant positive relationship between behavioral intention and adoption of a BDA-EAP management system. Meanwhile, behavioral intention, resistance to change, and extrinsic motivation have a significant three-way interaction impact on adoption of a BDA-EAP management system such that an increase in users? extrinsic motivation will decrease the negative impact of resistance to change during the process of adoption. The study findings contribute to the literature regarding the use of BDA to manage EAP, and provide a basis for future research in this area.","Big data analytics; Environmental air pollution; BDA-EAP management system; UTAUT; Task-technology fit","Advanced Analytics; Air pollution; Behavioral research; Big data; Data Analytics; Environmental management; Human resource management; Motivation; Surveys; Environmental agency; Environmental air pollution; Extrinsic motivation; Structural equation modeling; Tasktechnology fits (TTF); Technology characteristics; The unified theory of acceptance and use of technology(UTAUT); Three-way interactions; atmospheric pollution; data set; environmental management; technology adoption; Information management","TECHNOLOGY ACCEPTANCE MODEL; DECISION-SUPPORT-SYSTEM; EXTRINSIC MOTIVATION; INFORMATION-TECHNOLOGY; EMPLOYEES RESISTANCE; DEVELOPING-COUNTRY; DIGITAL LIBRARIES; PERCEIVED EASE; VARIABLES; UTAUT","WOS"
140,"10.1016/j.envres.2019.108864","Environmental data treatment to support exposure studies: The statistical behavior for NO2, O3, PM10 and PM2.5 air concentrations in Europe","Bartzis, JG; Kalimeri, KK; Sakellaris, IA",2020,"ENVIRONMENTAL RESEARCH","181","","In determining and assessing external exposure, there is a need for extensive environmental data sets of sufficient time and space resolution. It is unlikely that a complete set of those data exist for a specific study. Therefore, there will be a need to fill the necessary data gaps. As a first step towards this direction, the statistical behavior of the parameters involved can be estimated so that such parameters can be statistically reconstructed in finer scales. In this study the methodology has been applied to the air concentrations of the priority pollutants NO2, O-3, PM10 (particulate matter with an aerodynamic diameter of < 10 mu m) and PM2.5 (particulate matter with an aerodynamic diameter of < 2.5 mu m). More specifically, the hourly and the daily concentrations at a given site of those pollutants can be statistically reconstructed assuming known (a) the concentration annual average (m), (b) the pdf of the ratio of the standard deviation over the annual average (sigma/m) for the hourly/daily concentrations and (c) the pdf for hourly/daily concentrations themselves. In the case that PM2.5 annual value is missing, it is estimated statistically from the PM10 annual value and the PM2.5/PM10 ratio statistics. As a first test, the proposed methodology is applied for the year 2012 arriving to concrete proposals concerning the statistical behavior of the above-mentioned parameters.","Air concentrations; External exposure; Nitrogen dioxide; Ozone; Particulate matter","","IMPUTATION; EXPOSOME","WOS"
442,"10.18502/japh.v6i2.7956","Evaluating physicians' knowledge, attitude and practice of their ethical responsibilities towards the environmental problem and air pollution","Tehrani S.S.; Larijani B.; Parsapoor A.; Rashidpouraie R.; Madani M.",2021,"","6.0","2","Introduction: Today, 25% of diseases in the world are directly or indirectly caused by environmental problems. The present study attempts to clarify physicians’ moral responsibility in this regard and the roles they can play to decrease environmental problems. It also evaluates their attitudes towards and performance of these roles. The clarification of this issue paves the way for interventions through effective education or policy-making, as well as directing useful research. Materials and methods: A questionnaire was developed based on the results of qualitive study. The questionnaire assessed physicians’ awareness, attitude, and performance with regard to their environmental moral responsibilities. Results: Physicians with longer work experience had better performance. Those who worked in offices or at universities had also better performances compared to those working in hospitals. Physicians with more awareness had better performance, especially those who had acquired this awareness through books and educational workshops. The source of information was an effective factor on the gap between physicians’ attitude and performance scores those who had acquired information from books had the narrowest gap and those who had received information from social networks had the widest gap between attitude and performance scores. Conclusion: The health system and the environment and its problems are intertwined and greatly influence each other. Thus this interrelation and the necessity of being concerned and having moral sensitivity were explained. © 2021 Tehran University of Medical Sciences. Published by Tehran University of Medical Sciences.","Air pollution; Environmental moral responsibilities; Environmental problems; Physician attitude; Physician practice","","","Scopus"
337,"10.1111/j.0272-4332.2004.00550.x","Examining localized patterns of air quality perception in Texas: A spatial and statistical analysis","Brody S.D.; Peck B.M.; Highfield W.E.",2004,"","24.0","6","Environmental and human health issues associated with outdoor air pollution, such as ozone, sulfur dioxide, and other pollutants in metropolitan regions, are an area of growing concern for both policy officials and the general public. Increasing attention from the news media, new health data, and public debate over the effectiveness of clean air regulations have raised the importance of air quality in the public consciousness. While public perceptions of air quality have been studied thoroughly dating back to the 1960s, little empirical research has been conducted to explain the spatial aspects of these perceptions, particularly at the local level. Although recent studies suggest characteristics of local setting are important in shaping perceptions of air quality, the roles of proximity, neighborhood characteristics, and location have not been clarified. This study seeks to improve understanding of the major factors shaping public perceptions of air quality by examining the spatial pattern of local risk perception, the role of socioeconomic characteristics in forming these perceptions, and the relationship between perceived and scientifically measured air pollution. First, we map the spatial pattern of local air quality perceptions using Geographic Information Systems (GIS) across the Dallas and Houston metropolitan areas. Next, we explain these perceptions through local contextual factors using both bivariate correlations and multivariate regression analysis. Results indicate that perceptions of air quality in the study areas are not significantly correlated with air quality based on readings of air monitoring stations. Instead, perceptions appear to be influenced by setting (urban vs. rural), state identification, access to information, and socioeconomic characteristics such as age, race, and political identification. We discuss the implications of the findings and provide direction on how further research can provide a deeper understanding of the local contextual factors influencing public perceptions.","Air quality; Environmental perceptions; Geographic Information Systems; Texas","Air Pollutants; Cities; Environment; Environmental Exposure; Environmental Health; Environmental Monitoring; Humans; Ozone; Perception; Public Opinion; Regression Analysis; Research; Social Class; Statistics; Texas; North America; Texas; United States; Western Hemisphere; World; Air pollution; Economic and social effects; Geographic information systems; Health; Information retrieval; Ozone; Statistical methods; Sulfur dioxide; ozone; sulfur dioxide; air quality; atmospheric pollution; metropolitan area; perception; spatial analysis; statistical analysis; air; air monitoring; air pollution; air quality; air quality standard; article; data analysis; environmental health; environmental sanitation; geographic distribution; geographic information system; methodology; pollution monitoring; regression analysis; socioeconomics; spatial autocorrelation analysis; statistical analysis; United States; Bivariate correlations; News media; Public perceptions; State identification; Air quality","","Scopus"
573,"10.3390/su11184835","Experts' perceptions on the particulate matter reduction effects of green open space","Kim S.; Han S.; Lee S.-W.; An K.",2019,"","11.0","18","With recent declines in air quality, the significance of urban green spaces and their ecological functions have rapidly increased, especially with regard to the reduction of particulate matter. Various investigations regarding particle reduction in urban green spaces have been conducted; however, specific guidelines to establish empirical data for green spaces and to inform related policies are still lacking. Thus, this study aims to categorize experts' perceptions of green spaces through Q-methodology and to identify ways to form a consensus, establish policies in the design and construction process, ultimately aiming to enhance particle reduction effects in urban green spaces. As a result, experts' perceptions were classified into three categories: 'active support,' 'skeptical,' and 'passive support' groups. Experts' opinions on the particle reduction effects of urban green areas are overarchingly agreed upon; however, the priorities involved and methods used in augmenting green space integration require further analysis and mediation. Additionally, further empirical evidence should be accumulated on the particulate matter reduction effects of urban green areas, including the quantification of particle concentration reduction in urban green spaces and considerations for policy establishment in design and construction. © 2019 by the authors.","Air pollution; Air pollution policy; Particulate matter; Q-method; Urban forest","air quality; atmospheric pollution; greenspace; numerical method; open space; particulate matter; perception; pollution policy; urban forestry; urban policy","","Scopus"
53,"10.1007/s11625-021-01038-2","How do we effectively communicate air pollution to change public attitudes and behaviours? A review","Riley, R; de Preux, L; Capella, P; Mejia, C; Kajikawa, Y; de Nazelle, A",2021,"SUSTAINABILITY SCIENCE","16","6","Solutions that engage the public are needed to tackle air pollution. Technological approaches are insufficient to bring urban air quality to recommended target levels, and miss out on opportunities to promote health more holistically through behavioural solutions, such as active travel. Behaviour change is not straightforward, however, and is more likely to be achieved when communication campaigns are based on established theory and evidence-based practices. We systematically reviewed the academic literature on air pollution communication campaigns aimed at influencing air pollution-related behaviour. Based on these findings, we developed an evidence-based framework for stimulating behaviour change through engagement. Across the 37 studies selected for analyses, we identified 28 different behaviours assessed using a variety of designs including natural and research-manipulated experiments, cross-sectional and longitudinal surveys and focus groups. While avoidance behaviour (e.g. reducing outdoor activity) followed by contributing behaviours (e.g. reducing idling) were by far the most commonly studied, supporting behaviour (e.g. civil engagement) shows promising results, with the added benefit that supporting local and national policies may eventually lead to the removal of social and physical barriers that prevent wider behavioural changes. Providing a range of actionable information will reduce disengagement due to feelings of powerlessness. Targeted localized information will appear more immediate and engaging, and positive framing will prevent cognitive dissonance whereby people rationalize their behaviour to avoid living with feelings of unease. Communicating the co-benefits of action may persuade individuals with different drivers but as an effective solution, it remains to be explored. Generally, finding ways to connect with people's emotions, including activating social norms and identities and creating a sense of collective responsibility, provide promising yet under-explored directions. Smartphones provide unique opportunities that enable flexible and targeted engagement, but care must be taken to avoid transferring responsibility for action from national and local authorities onto individuals. Multidisciplinary teams involving artists, members of the public, community and pressure groups, policy makers, researchers, and businesses, are needed to co-create the stories and tools that can lead to effective action to tackle air pollution through behavioural solutions.","Air quality; Communication; Engagement; Campaign; Information role","","HEALTH BELIEF MODEL; METROPOLITAN-AREA; QUALITY WARNINGS; SOCIAL NORMS; INFORMATION; ALERTS; IMPACT; CONSERVATION; SCIENCE; OZONE","WOS"
