"ID","DOI","Title","Authors","Year","Source.Title","Volume","Issue","Abstract","Author.Keywords","Scopus.Keywords","WOS.Keywords","Source"
20,"10.1007/s10389-023-02004-1","Significant importance of negative affect and satisfaction with local governmental air control of objective air pollution, perceived air quality, and pro-environmental behavior relationships","Yang, CY; Hao, CX; Huang, LZ; Qiu, XH; Chen, XY",2025,"JOURNAL OF PUBLIC HEALTH-HEIDELBERG","33","1","BackgroundAir pollution has aroused global concerns because of its adverse effects on individuals' physical and psychological health and behavior. Although there has been substantial traditional consideration of the objective impact of air pollution, more knowledge is needed about perceived air quality (PAQ), its association with objective air pollution (OAP), and the relationship between OAP and PAQ with respect to pro-environmental behavior (PEB).MethodsTo delineate and investigate the effect of air pollution on both perceived and objective perspectives of PEB and its underlying psychological mechanisms, this study distributed a survey questionnaire related to PAQ, the Positive and Negative Affect Schedule (PANAS), satisfaction with local governmental control of air quality (SAT), and the PEB scale. The monitored data of objective city-level air pollution and 391 samples of survey data were included in this study.ResultsThe results reveal that both PAQ and OAP increase individuals' negative affect (NA) and decrease SAT, which sequentially restrains PEB. More importantly, PAQ, NA, and SAT played mediating roles in the relationship between OAP and PEB. Empirical testing for group difference also indicated that while there is no gender-related difference with respect to caring about SAT and PEB caused by air pollution, gender effects on NA were significantly different. Age-related differences exist among younger, medium, and older age groups with respect to NA, SAT, and PEB caused by air pollution, and there are also background differences with respect to NA, SAT, and PEB, although income does not generate a significant group difference effect on NA, SAT, and PEB.ConclusionsThe findings corroborate the important roles of affect and SAT in activating public concern about air quality. We discuss the possible ways that affect and SAT might enhance PEB as well as the limitations of this study. More pollutants and mechanisms could be considered in future studies.","Perceived air quality; Objective air pollution; Negative affect; Satisfaction with the local air quality; Pro-environmental behavior","","LIFE SATISFACTION; SOCIOECONOMIC-STATUS; RESPIRATORY HEALTH; ANNOYANCE SCORES; MENTAL-HEALTH; PERCEPTION; HAPPINESS; EXPOSURE; CHINA; RISK","WOS"
387,"10.1186/1471-2458-12-819","Small proportions of actively-smoking patrons and high PM2.5 levels in southern California tribal casinos: support for smoking bans or designated smoking areas","Klepeis, NE; Omoto, J; Ong, SL; Omoto, HS; Dhaliwal, N",2012,"BMC PUBLIC HEALTH","12","","Background: Nearly all California casinos currently allow smoking, which leads to potentially high patron exposure to secondhand tobacco smoke pollutants. Some argue that smoking restrictions or bans would result in a business drop, assuming > 50% of patrons smoke. Evidence in Nevada and responses from the 2008 California tobacco survey refute this assertion. The present study investigates the proportion of active smokers in southern California tribal casinos, as well as occupancy and PM2.5 levels in smoking and nonsmoking sections. Methods: We measured active-smoker and total-patron counts during Friday or Saturday night visits (two per casino) to smoking and nonsmoking gaming areas inside 11 southern California casinos. We counted slot machines and table games in each section, deriving theoretical maximum capacities and occupancy rates. We also measured PM2.5 concentrations (or used published levels) in both nonsmoking and smoking areas. Results: Excluding one casino visit with extremely high occupancy, we counted 24,970 patrons during 21 casino visits of whom 1,737 were actively smoking, for an overall active- smoker proportion of 7.0% and a small range of similar to 5% across casino visits (minimum of 5% and maximum of 10%). The differences in mean inter-casino active-smoker proportions were not statistically significant. Derived occupancy rates were 24% to 215% in the main (low-stakes) smoking-allowed slot or table areas. No relationship was found between observed active-smoker proportions and occupancy rate. The derived maximum capacities of nonsmoking areas were 1% to 29% of the overall casino capacity (most under 10%) and their observed occupancies were 0.1 to over 3 times that of the main smoking-allowed casino areas. Seven of twelve visits to nonsmoking areas with no separation had occupancy rates greater than main smoking areas. Unenclosed nonsmoking areas don't substantially protect occupants from PM2.5 exposure. Nonsmoking areas encapsulated inside smoking areas or in a separate, but unenclosed, area had PM2.5 levels that were 10 to 60 mu g/m(3) and 6 to 23 mu g/m(3) higher than outdoor levels, respectively, indicating contamination from smoking. Conclusions: Although fewer than roughly 10% of casino patrons are actively smoking on average, these individuals substantially increase PM2.5 exposure for all patrons in smoking and unenclosed nonsmoking areas. Nonsmoking areas may be too inconvenient, small, or undesirable to serve a substantial number of nonsmoking patrons. Imposing indoor smoking bans, or contained smoking areas with a maximum capacity of up to 10% of the total patronage, would offer protection from PM2.5 exposures for nonsmoking patrons and reduce employee exposures.","Secondhand smoke; Fine particles; Active smoker counts; Nonsmoking gaming","Air Pollution, Indoor; California; Gambling; Humans; Particulate Matter; Smoking; Tobacco Smoke Pollution; MLCS; MLOWN; article; human; indoor air pollution; particulate matter; passive smoking; pathological gambling; smoking; United States","ENVIRONMENTAL TOBACCO-SMOKE; SECONDHAND SMOKE; AIR-POLLUTION; EXPOSURE","WOS"
696,"","Survey on the use of a novel endonasal disposable device proposed in order to capture and eliminate air polluting particulate matter; [Sondaggio d'opinione sull'impiego di un innovativo dispositivo usa-e-getta endonasale per la cattura e l'eliminazione del particolato aerocontaminante]","Narciso P.; Cantera E.; Picano A.; Allegra L.",2009,"","63.0","5","Foreword. It has recently been patented and presented a novel individual endonasal disposable medical device (temporarily named Smart Nose), consisting in a couple of small cone trunks with an internal helix (the entire tool in soft medical silicone), which ""captures"" and eliminates airborne particulate matter, in particular of polluting origin (PM) but also of allergic nature. Air clearance from such noxious particles has been assessed, as well as nasal resistances, with different configurations of the device, and consequently the most ""equilibrated"" geometry has been selected considering the best possible ""filtering"" efficiency vs the best possible respect of nasal respiratory patency. The ""capturing"" properties of the device are due to a special biogel stratified on the internal surface of each cone trunk and helix: such biogel captures PM due to its electrostatic properties, fixes it thank to its high viscosity and eliminates it (it's disposable). Aim. This paper presents the results of a survey on the opinion of a sample of citizens about the potential agreement on such individual defense from atmospheric pollutants and other airborne noxious particles. Subjects andmethod.The interwiewed persons were 279 common citizens transiently exposed to urban outdoor pollution, but also persons more ""sensible"" to pollution and airborne particle-derived problems: 19 citizens suffering from allergic oculorhinitis and bronchial asthma, 50 workers operating in an open urban context or unhealthy environment, plus 52 snorers not belonging to such last two categories. Results. The survey in general has demonstrated high interest of the interviewed persons towards Smart Nose: a positive impression has been referred by 70% common citizens, 84% allergics, 73% ""polluted"" workers. 46% snorers. About 50% of the potential users are convinced about the utility of the device by the description of its characteriscics, others would prefer to test it in advance. Neither invasivity nor fear of unpleasant nasal sensations are likely to constitute a problem: a proposed costless proof is accepted by >90% of the sample, specially by younger people. Conclusion. Exposure to the inhalation to noxious particulate matter is a sensible problem for the citizens, specially those exposed to PM for professional reasons or allergic to pollens and other airborne allergens; less for subjects suffering from disturbances whose solution is linked to proper curative measures more than to preventive ones (snorers). Hope in possible measures intended to clear inspired air passes also through the expectance of relatively costless individual solutions such as that represented by Smart Nose device.","Aero-allergens; Air pollution; Medical device; Opinion survey; Particulate matter","allergen; air pollution; air pollution control; allergic rhinitis; asthma; cost benefit analysis; device; disposable equipment; endonasal disposable device; health care survey; human; interview; nose airway resistance; occupational exposure; particulate matter; pollen allergy; review; snoring; urban area","","Scopus"
105,"10.1016/j.cosust.2016.12.003","Sustainable policy-key considerations for air quality and climate change","Melamed, ML; Schmale, J; von Schneidemesser, E",2016,"CURRENT OPINION IN ENVIRONMENTAL SUSTAINABILITY","23","","Air quality and climate change are inexorably linked from their emission sources to their impacts on climate, human health, and ecosystems, including agriculture. However, in global environmental change and sustainability policies the link between air quality and climate change is often ignored. To facilitate including the link between air pollution and climate change in the policy process, three key considerations (1) mix of emissions, (2) lifetime, and (3) benefits and trade-offs should be taken into account. These three key considerations will help decision makers understand how proposed policies may impact the emissions of air pollutants and greenhouse gases and their resulting impacts on climate, human health, and ecosystems, thus reducing unintended consequences and likely resulting in additional economic and environmental benefits.","","","CO-BENEFITS; POLLUTION; SECURITY; HEALTH","WOS"
598,"10.3727/154427223X16717265382804","THE RELEVANCE OF AIR QUALITY PERCEPTIONS ON TRAVEL BEHAVIOR OF VISITORS WITH RESPIRATORY DISEASES","Rodrigues, V; Eusébio, C; Carneiro, MJ; Madaleno, M; Robaina, M; Gama, C; Monteiro, A",2023,"TOURISM REVIEW INTERNATIONAL","27","2","Air pollution is one of the most challenging environmental issues influencing the lifestyles of the world's population. Every year millions of respiratory diseases and premature deaths are directly attributed to it. Therefore, people who suffer from respiratory diseases are more vulnerable to variations in air quality, as direct exposure leads to exacerbation of symptoms, more hospitalizations, and behavioral changes. This study aims to examine the impact of air pollution on the travel behavior of people with respiratory diseases. To accomplish this objective, a mixed methodological approach is used, applying questionnaires and interviews. The results show that visitors with respiratory diseases are more likely to value air quality and to engage in adaptive measures to prevent the effects of air pollution episodes at the destination. This study enriches the tourism literature by examining how air quality influences visitors with respiratory illnesses and provides practical implications for the tourism industry.","Tourism; Respiratory diseases; Air quality; Adaptive behaviors; Travel behavior","","PARTICULATE MATTER; INBOUND TOURISM; POLLUTION; IMPACT; CHINA; SMOG; SEGMENTATION; ASSOCIATION; RESPONSES; PORTUGAL","WOS"
339,"10.1111/j.1539-6924.1984.tb00139.x","Technical Uncertainty in Quantitative Policy Analysis — A Sulfur Air Pollution Example","Morgan M.G.; Morris S.C.; Henrion M.; Amaral D.A.L.; Rish W.R.",1984,"","4.0","3","Expert judgments expressed as subjective probability distributions provide an appropriate means of incorporating technical uncertainty in some quantitative policy studies. Judgments and distributions obtained from several experts allow one to explore the extent to which the conclusions reached in such a study depend on which expert one talks to. For the case of sulfur air pollution from coal‐fired power plants, estimates of sulfur mass balance as a function of plume flight time are shown to vary little across the range of opinions of leading atmospheric scientists while estimates of possible health impacts are shown to vary widely across the range of opinions of leading scientists in air pollution health effects. Copyright © 1984, Wiley Blackwell. All rights reserved","air pollution health effects; coal‐fired power plant; long‐range transport; stochastic simulation; subjective expert judgement; sulfate; sulfur air pollution; Uncertainty","ENVIRONMENTAL ENGINEERING - Public Policy; PROBABILITY - Random Processes; sulfur; air pollution; atmospheric transport; diagnosis; ecology; electric power plant; etiology; human; methodology; nonbiological model; JUDGMENT UNDER UNCERTAINTY; QUANTITATIVE POLICY ANALYSIS; SULFUR AIR POLLUTION; TECHNICAL UNCERTAINTY; AIR POLLUTION","","Scopus"
402,"10.1186/s12890-018-0584-x","Test-retest repeatability of child's respiratory symptoms and perceived indoor air quality - comparing self-and parent-administered questionnaires","Lampi, J; Ung-Lanki, S; Santalahti, P; Pekkanen, J",2018,"BMC PULMONARY MEDICINE","18","1","Background: Questionnaires can be used to assess perceived indoor air quality and symptoms in schools. Questionnaires for primary school aged children have traditionally been parent-administered, but self-administered questionnaires would be easier to administer and may yield as good, if not better, information. Our aim was to compare the repeatability of self- and parent-administered indoor air questionnaires designed for primary school aged pupils. Methods: Indoor air questionnaire with questions on child's symptoms and perceived indoor air quality in schools was sent to parents of pupils aged 7-12 years in two schools and again after two weeks. Slightly modified version of the questionnaire was administered to pupils aged 9-12 years in another two schools and repeated after a week. 351 (52%) parents and 319 pupils (86%) answered both the first and the second questionnaire. Test-retest repeatability was assessed with intra-class correlation (ICC) and Cohen's kappa coefficients (k). Results: Test-retest repeatability was generally between 0.4-0.7 (ICC; k) in both self-and parent-administered questionnaire. In majority of the questions on symptoms and perceived indoor air quality test-retest repeatability was at the same level or slightly better in self-administered compared to parent-administered questionnaire. Agreement of self-and parent administered questionnaires was generally < 0.4 (ICC; k) in reported symptoms and 0.4-0.6 (ICC; k) in perceived indoor air quality. Conclusions: Children aged 9-12 years can give as, or even more, repeatable information about their respiratory symptoms and perceived indoor air quality than their parents. Therefore, it may be possible to use self-administered questionnaires in future studies also with children.","Repeatability; Symptoms; Indoor air questionnaire","Abdominal Pain; Air Pollution, Indoor; Arthralgia; Asthma; Child; Cough; Dust; Fatigue; Female; Fever; Finland; Headache; Hoarseness; Humans; Male; Odorants; Parents; Pharyngitis; Reproducibility of Results; Respiratory Sounds; Schools; Self Report; Surveys and Questionnaires; fragrance; air quality; ambient air; Article; asthma; case control study; child; child parent relation; controlled study; correlation coefficient; female; Finland; human; information processing; kappa statistics; male; measurement repeatability; population research; prevalence; questionnaire; school child; self report; test retest repeatability; abdominal pain; abnormal respiratory sound; arthralgia; asthma; coughing; dust; fatigue; fever; headache; hoarseness; indoor air pollution; pathophysiology; pharyngitis; reproducibility; school; self report","HEALTH; ASTHMA; AGREEMENT; PREVALENCE; SCHOOLCHILDREN; POLLUTION; RESPONSES; KAPPA; VIDEO; WORK","WOS"
21,"10.1007/s10563-019-09265-5","The Effect of K Salts on SO2-SO3 Conversion and Denitration Behavior over V2O5-WO3/TiO2 Catalysts","Xiao, HP; Dou, CZ; Ru, Y; Qi, C; Cai, L",2019,"CATALYSIS SURVEYS FROM ASIA","23","1","A series of V2O5-WO3/TiO2 catalysts treated by KCl or K2SO4 were prepared using the equal volume impregnation method. The effects of adding these K salts on SO2-SO3 conversion and on denitration behavior over the catalyst were studied, using reactor trials and various characterization methods, including NH3-TPD, H-2-TPR, ICP, BET, XRD, SEM, FT-IR and XPS. The results of catalytic activity evaluation tests show that adding K salts decreases the denitration efficiency, while SO2 enhances the activity of the KCl-poisoned catalyst to an extent. The presence of K salts also improves the SO3 formation rate, such that the SO3 formation rate for the K2SO4-poisoned catalyst is as high as 1.53% at 410 degrees C (compared with 0.60% for the fresh catalyst). The characterization data indicate that K salts aggregate on the catalyst surface, blocking the pores of the catalyst. The reduction ability of the catalyst is decreased slightly and new weakly acidic sites appear. In addition, the concentration of strongly acidic sites declines. SO2 can increase the surface acidity of the catalyst. K salts increase the number of V5+=O bonds and weakly acidic sites, but consume oxygen atoms along with V and W species. Importantly, the strength of the V5+=O bonds, the concentration of surface chemically adsorbed oxygen and the V4+/V5+ ratio all played vital roles in improving the conversion of SO2-SO3 and in enhancing the NO reduction. [GRAPHICS] .","K poisoning; SO3; SO42-; V2O5-WO3; TiO2 catalysts; Denitration","","V2O5/WO3-TIO2 SCR CATALYSTS; CHEMICAL DEACTIVATION; TEMPERATURE NH3-SCR; TITANIA CATALYSTS; REDUCTION; OXIDE; NOX; POTASSIUM; ADDITIVES; OXIDATION","WOS"
251,"10.1055/a-0873-3574","The Role of Air Pollutants for Health: A Reply to the Expert Opinion of the International Society for Environmental Epidemiology (ISEE) and the European Respiratory Society (ERS); [Die Rolle der Luftschadstoffe für die Gesundheit: Eine Replik auf die Expertise der Internationalen Gesellschaft für Umweltepidemiologie (ISEE) und der European Respiratory Society (ERS)]","Köhler D.; Hetzel M.; Klingner M.; Koch T.; Ewig S.; Becher G.; Lindemann H.; Voshaar T.; Costabel U.",2019,"","73.0","5","[No abstract available]","","air pollutant; Article; health; human; medical society; priority journal","","Scopus"
57,"10.1007/s11869-020-00928-1","The fragranced products phenomenon: air quality and health, science and policy","Steinemann A.",2021,"","14.0","2","Fragrance is used in consumer products around the world. However, fragrance has been associated with adverse effects on indoor and outdoor air quality and human health. Questions arise, such as the following: Why does fragrance in products pose problems? What are sources of emissions and exposures? What are health and societal effects? What are possible solutions? This paper examines the issue of fragranced consumer products and its science and policy dimensions, with a focus on the implications for air quality and human health. Results include new findings and new questions for future research directions. © 2020, The Author(s).","Fragrance-free policies; Fragranced consumer products; Hazardous air pollutants; Indoor air quality; Outdoor air quality; Volatile organic compounds","air quality; detection method; pollution exposure; public health; questionnaire survey","","Scopus"
416,"10.1371/journal.pone.0196783","The mediating role of risk perception in the association between industry-related air pollution and health","Bergstra, AD; Brunekreef, B; Burdorf, A",2018,"PLOS ONE","13","5","Background Heavy industry emits many potentially hazardous pollutants into the air which can affect health. Awareness about the potential health impacts of air pollution from industry can influence people's risk perception. This in turn can affect (self-reported) symptoms. Our aims were to investigate the associations of air pollution from heavy industry with health symptoms and to evaluate whether these associations are mediated by people's risk perception about local industry. Methods A cross-sectional questionnaire study was conducted among children (2-18 years) and adults (19 years and above) living in the direct vicinity of an area with heavy industry. A dispersion model was used to characterize individual-level exposures to air pollution emitted from the industry in the area. Associations between PM2.5 and NOx with presence of chronic diseases (adults) and respiratory symptoms (adults and children) were investigated by logistic regression analysis. Risk perception was indirectly measured by worries about local industry (0-10 scale). Mediation analyses were performed to investigate the role of mediation by these worries. Results The response was 54% (2,627/4,877). In adults exposure to modelled PM2.5 from industry (per mu g/m(3)) was related with reported high blood pressure (OR 1.56, 95% CI 1.13-2.15) and exposure to modelled NOx (per mu g/m(3)) was inversely related with cardiovascular diseases (OR 0.91, 95% CI 0.84-0.98). In children higher PM2.5 and NOx concentrations (per mu g/m(3)) were related with wheezing (OR 2.00, 95% CI 1.24-3.24 and OR 1.13, 95% CI 1.06-1.21 respectively) and dry cough (OR 2.33, 95% CI 1.55-3.52 and OR 1.16, 95% CI 1.10-1.22 respectively). Parental worry about local industry was an important mediator in exposure-health relations in children (indirect effect between 19-28%). Conclusion Exposure from industry was associated with self-reported reported high blood pressure among adults and respiratory symptoms among their children. Risk perception was found to mediate these associations for children.","","Adolescent; Adult; Aged; Air Pollutants; Air Pollution; Attitude to Health; Child; Child, Preschool; Chronic Disease; Cross-Sectional Studies; Environmental Exposure; Environmental Health; Health Behavior; Humans; Hypertension; Manufacturing and Industrial Facilities; Middle Aged; Netherlands; Nitrogen Oxides; Particulate Matter; Respiration Disorders; Risk Assessment; Smoking; Socioeconomic Factors; Surveys and Questionnaires; Young Adult; benzene; dioxin; ethylene; formaldehyde; nitrogen oxide; sulfur dioxide; toluene; adult; aged; air pollution; Article; asthma; cardiovascular disease; child; chronic bronchitis; chronic disease; chronic obstructive lung disease; coughing; cross-sectional study; educational status; environmental exposure; female; health behavior; health impact assessment; human; hypertension; industry; lung emphysema; male; Netherlands; perception; population group; prevalence; questionnaire; risk; smoking; wheezing; young adult; adolescent; air pollutant; air pollution; attitude to health; breathing disorder; chronic disease; clinical trial; environmental health; hypertension; middle aged; multicenter study; particulate matter; preschool child; psychology; risk assessment; socioeconomics; toxicity","RESPIRATORY SYMPTOMS; CHILDHOOD ISAAC; LUNG-FUNCTION; ASTHMA; CHILDREN; PREVALENCE; ALLERGIES; ANNOYANCE; EXPOSURE; SITE","WOS"
