"ID","DOI","Title","Authors","Year","Source.Title","Volume","Issue","Abstract","Author.Keywords","Scopus.Keywords","WOS.Keywords","Source"
94,"10.1016/j.buildenv.2021.107736","Human response to thermal environment and perceived air quality in an office with individually controlled convective and radiant cooling systems","Zhao, WX; Kilpeläinen, S; Kosonen, R; Jokisalo, J; Lestinen, S; Wu, YX; Mustakallio, P",2021,"BUILDING AND ENVIRONMENT","195","","The purpose of this study is to analyze the human response to the indoor climate with two individually controlled convective and radiant cooling systems: a low velocity unit combined with radiant panel system (LVRP) and a personalized ventilation system combined with a radiant panel system (PVRP). As a reference system without individual control, diffuse ceiling ventilation combined with a radiant panel system (DCV-RP) was also studied. In laboratory conditions, 10 males and 10 females gave subjective response to the indoor climate during various office activities. The indoor parameters and CO2 concentrations were measured. The results show that with the reference DCV-RP system, the indoor conditions were worse than with the LVRP and PVRP systems. The thermal sensation and perceived air quality with the PVRP system was better than the LVRP system. After a medium activity task, the thermal acceptability reverts faster with the PVRP than LVRP system. Both the LVRP and PVRP systems were able to create a micro-environment around the workstations and the CO2 concentrations near the workstation were slightly lower than at the exhaust grille. Compared with the PVRP system, the subjects preferred the higher airflow rate at the workstation with the LVRP system. Males preferred a higher airflow rate than females under the same conditions with both micro-environment systems. This research found that there was significant variation in the control preferences of the human subjects concerning the micro-environment, and this emphasizes the need for personalized control to ensure that all occupants are satisfied with the indoor conditions.","Human response; Personalized control; Micro-environment; Perceived air quality; Thermal sensation; CO2 concentration","","PRODUCTIVITY LOSS; COMFORT; SENSATION; PERFORMANCE; TEMPERATURE; MOVEMENT; HEALTH; WORK; WARM","WOS"
72,"10.1016/0160-4120(82)90004-6","Indoor air pollution and public policy","Sexton K.; Repetto R.",1982,"","8.0","1-6","In recent years, scientist have come to realize that contaminated air inside buildings is a major route of human exposure to certain air pollutants. While scientific interest in the problem continues to grow, efforts to measure indoor pollution concentrations, define exposure levels, and estimate health risks remain in their infancy. Within this arena, policymakers must deal with the question of how best to protect public health and safety in the face of incomplete and often contradictory information. In the past, official response to environmental pollution has traditionally taken the form of ""control by regulation."" However, creation of a regulatory framework for indoor air quality poses special policy issues that suggest the need to explore alternative modes of intervention. Ambient outdoor air is a public good, in the sense that enjoyment by one individual in no way detracts from use or enjoyment by others. Indoor air, on the other hand, is not a public good, especially in private residences. Costs and benefits of maintaining adequate indoor air quality are internalized within households, suggesting the possibility of a private demand for clean indoor air. Promulgation of indoor air quality standards and other regulations must confront the fact that individuals are already making decisions about their own air quality. Regulations might or might not improve these decisions. Development of effective and reasonable policy requires an appreciation of the scope for private action and consideration of the likelihood that public intervention will foster improved private choices. Among the logical and relatively inexpensive modes of intervention are public information programs, development of simple warning devices, and product testing and labeling. © 1982.","","BUILDINGS; ENVIRONMENTAL ENGINEERING - Public Policy; ENVIRONMENTAL PROTECTION; air quality control; housing; human; indoor air pollution; prevention; public opinion; therapy; REGULATIONS; AIR POLLUTION","","Scopus"
95,"10.1016/j.buildenv.2022.108933","Indoor air quality for sustainable building renovation: A decision-support assessment system using structural equation modelling","Ismaeel, WSE; Mohamed, AG",2022,"BUILDING AND ENVIRONMENT","214","","This study scrutinized indoor air quality (IAQ) and symptoms of Sick Building Syndrome (SBS) for a sustainable building renovation (SBR). A systemic review of existing literature was performed, including identification, screening, and scoping phases. This was followed by a keyword-based scientometric analysis. By further refining keywords, this tri-dimensional relationship was highlighted through cross-disciplinary knowledge interactions using a content analysis method. A network analysis map helped identify critical criteria and sub-criteria, later categorized into four clusters of governing data variables. A survey-based Relative Importance Weight (RIW) benchmark was performed for each variable, exhibiting its contribution towards attaining an efficient IAQ-SBR process. The Structural Equation Modelling (SEM) was used to develop a Decision Support System (DSS). This set the system's structure incorporating four hierarchical levels of assessment for achieving an IAQ-SBR. A case study building was followed to test the proposed model in a real context. In sum, this study succeeded in (1) expanding the definition and evaluation of SBR to account for IAQ, (2) developing a DSS for assessing the sustainability of the renovation process, prioritizing actions, as well as tracking and benchmarking the effect of renovation activities on IAQ, (3) creating a comprehensive comparative and absolute assessment using variables' RIWs and loading factors. The presented approach portrayed a novel academic and industry outreach contribution that put IAQ at the heart of building renovation practices. It also showed the necessity of adopting an integrated thinking approach to account for interrelated variables for an efficient IAQ-SBR.","Decision-support system; Indoor air quality; Sick building syndrome; Structural equation modelling; Sustainable building renovation; Sustainable renovation assessment","Air quality; Artificial intelligence; Indoor air pollution; Intelligent buildings; Petroleum reservoir evaluation; Sustainable development; Assessment system; Building renovation; Decision supports; Indoor air quality; Scoping; Sick building syndrome; Structural equation models; Sustainable building; Sustainable building renovation; Sustainable renovation assessment; air quality; building; decision support system; indoor air; maintenance; numerical model; regression analysis; sustainability; symptom; Decision support systems","PARTICULATE MATTER; ENERGY PERFORMANCE; POLLUTION; POWER; TOOL","WOS"
629,"10.5846/STXB202104060883","Influence of haze in urban greenspace on behavioral decision-making and physical and mental health of the elderly; [城市绿地雾霾对老年人行为决策与身心健康的影响]","Yang B.; Chen Y.",2022,"","42.0","9","As important green infrastructure, greenspaces in high-density central urban districts serve as an important outdoor space for the surrounding residents, especially the elderly. Meanwhile, the ambient air pollution via particulate matter in such areas is closely related to the physical and mental health of the elderly visitors who suffer long-term exposure. This study is initiated to build a technological path between haze exposure and the elderly based on the positive and negative relationship between greenspace exposure and haze exposure under the background of the national strategy of healthy aging. In addition, the structured questionnaire interviews and the measured evidence-based experiments were conducted to collect data including physical environment data, crowd activity data, haze cognition data and basic population information. Combined with various statistical analyses including correlation analysis and mediating factor analysis, the impacts of haze in urban greenspaces on the decisions of the elderly to go out to visit such spaces as well as their physical and mental health were explored. A total of 138 crowd activity data and climate data were recorded, and 200 valid questionnaires were obtained. The results showed that the physical exercise and the social contact were two main reasons for the elderly to the greenspaces, and the typical activities of the elderly varied with the difference of physical environment using correlation and mediating effect analysis. Moreover, the air quality of six research sites reached or even be above moderate pollution (PM2.5 ≥115μg/ m3) during more than 70% of the survey period, suggesting that the air quality was worrying and exposed elderly visitors to serious health risks. According to questionnaire, the cognitive limitations on the potential hazards of haze were commonly existed in the elderly due to insufficient understanding of haze, vague perception and psychological neglect. In addition, the multiple and complex internal driving forces led to the decision-making of the elderly people to go to the greenspaces more perceptual than rational. Overall, there is no prominent correlation between PM2.5 concentration and crowd activities, showing that haze has little impact on the travel decision of the elderly since their insensitivity to haze pollution. There exists a gap between the cognitive decision of the elderly and the actual potential health hazards of haze. The results highlight the urgency of measures to promote healthy aging, and the importance of actively promoting the optimization of elderly-oriented landscape, which has certain reference value for the current human settlement environment construction. © 2022 Science Press. All rights reserved.","greenspace; haze; health; mediating effect; PM<sub>2.5</sub>; the elderly","air quality; atmospheric pollution; concentration (composition); decision making; elderly population; greenspace; haze; health impact; health risk; particulate matter; perception; pollution exposure; questionnaire survey; urban area","","Scopus"
352,"10.1117/12.2625583","Intelligent classification algorithm for air pollution-related microblog texts with public perception","Li, Z; Li, M; Sun, Y; Han, YX",2021,"INTERNATIONAL CONFERENCE ON ENVIRONMENTAL REMOTE SENSING AND BIG DATA (ERSBD 2021)","12129","","In order to achieve intelligent classification of air pollution-related microblog texts with semantically mixed public perception, with the help of the Word2Vec model developed by Google, this paper uses a large number of microblog texts as the training set for word vectors training, the trained word vectors are embedded in convolutional neural network (referred to as CNN) model. Based on the established classification criteria of gaseous pollution, dust pollution, smoke pollution and haze pollution, the 1000 air pollution-related microblogs were screened out to design and implement an automatic and intelligent classification algorithm. The experimental results show that the overall accuracy rate is 94.75% and the overall recall rate is 94.50%, which can meet the accurate classification of air pollution-related microblog texts, and provide accurate corpus data for later analysis of the semantic features of air pollution topics and the public's perceived emotional intensity.","microblog texts; air pollution; text classification; convolutional neural network; public perception","","","WOS"
602,"10.4028/www.scientific.net/AMR.518-523.928","Investigation and Assessment on Perceive Air Quality of Dormitory Building","Xu, YM; Sun, KC",2012,"ADVANCES IN ENVIRONMENTAL SCIENCE AND ENGINEERING, PTS 1-6","518-523","","Sleep quality and mental health are directed influence to dormitory air quality. Sleep mode Work schedules is established by questionnaires, after the interconnection of PAQ, QPD and ACC is analysised, air quality of dormitory building is assessmented. The results show that dormitory air quality is influenced by windowing and living habit of undergraduate and the proportion of the dissatisfaction of air quality below 20%.","Air Quality; PAQ; QPD","","","WOS"
674,"","Land use as an air quality control measure - Review of current practice and examination of policy options","Ang-Olson, J; Fischer, M; Dulla, R",2000,"ENERGY, AIR QUALITY, AND FUELS 2000: ENERGY AND ENVIRONMENT","","1738","The inclusion of sustainable land use policies and programs for emissions credit in the air quality planning process is examined. Reviewed first is the role of land use in procedures for development of the state implementation plan (SIP) and the transportation conformity determination. Twenty-seven metropolitan areas were surveyed to identify how land use currently is incorporated into air quality plans. The survey found nine metropolitan areas that include a control measure involving land use in an air quality plan, though only two of these actually quantify an emission reduction from the measure. Then three general policy options are examined that could allow for better accounting of the air quality benefits of sustainable land use. One option is to enhance transportation and land use forecasting procedures so that they better capture land use and design features. A second option is to adopt land use policies as an explicit SIP control measure. A third option Is to show an emissions reduction from land use as part of a transportation plan conformity determination. Existing rules are reviewed concerning each of these options, and how they would apply to land use measures is discussed.","","","","WOS"
474,"10.3141/1738-04","Land use as an air quality control measure Review of current practice and examination of policy options","Ang-Olson J.; Fischer M.; Dulla R.",2000,"","","1738","The inclusion of sustainable land use policies and programs for emissions credit in the air quality planning process is examined. Reviewed first is the role of land use in procedures for development of the state implementation plan (SIP) and the transportation conformity determination. Twenty-seven metropolitan areas were surveyed to identify how land use currently is incorporated into air quality plans. The survey found nine metropolitan areas that include a control measure involving land use in an air quality plan, though only two of these actually quantify an emission reduction from the measure. Then three general policy options are examined that could allow for better accounting of the air quality benefits of sustainable land use. One option is to enhance transportation and land use forecasting procedures so that they better capture land use and design features. A second option is to adopt land use policies as an explicit SIP control measure. A third option is show an emissions reduction from land use as part of a transportation plan conformity determination. Existing rules are reviewed concerning each of these options, and how they would apply to land use measures is discussed.","","Air quality; Land use; Motor transportation; Planning; Public policy; Air quality planning; Emission reduction; State implementation plan; Vehicle miles traveled; Air pollution control","","Scopus"
448,"10.21668/HEALTH.RISK/2022.2.03","METHODICAL APPROACHES TO ASSESSING SUBJECTIVE HEALTH RISK PERCEPTION BY POPULATION UNDER EXPOSURE TO AMBIENT AIR POLLUTION; [МЕТОДИЧЕСКИЕ ПОДХОДЫ К ОЦЕНКЕ СУБЪЕКТИВНОГО ВОСПРИЯТИЯ РИСКА НАСЕЛЕНИЕМ ПРИ ВОЗДЕЙСТВИИ ЗАГРЯЗНЕНИЯ АТМОСФЕРНОГО ВОЗДУХА НА ЗДОРОВЬЕ]","Barg А.О.; Lebedeva-Nesevrya N.А.; Kornilitsyna М.D.",2022,"","2022.0","2","There is a growing demand by the civil society for relevant information on the environment quality and related health risks. The state should be able to satisfy this demand and this makes the present research truly vital. It concentrates on correlating expert and non-expert opinions expressed when perceiving risk quantification. Our goal was to answer two following questions: 1) How does an average unprofessional person quantify a probability and severity when he or she hears certain verbal expressions that denominate them? 2) How can we possibly identify the assessment of health risks associated with environmental pollution factors given by the population in general or specific social groups? To find answers to these questions, we applied quantitative methods for data collection and analysis. The first stage involved collecting data on subjective correlation of a verbal probability scale with its numeric expression among people living in industrial cities. The second stage focused on testing the methodology for studying assessments of health risks associated with ambient air pollution given by the population/social groups. This methodology relied on the results obtained at the previous stage. We established that only 70 % of people actually correlated words with figures. We determined that experts tended to rate probabilities approximately by 10 % higher than “average people” did when it came down to such words as “Virtually certain” and “Very likely”. Such words as “Likely”, “Similarly likely” and “Unlikely” were also rated differently but with a smaller gap between the opinions. The study also provides a method for determining the public assessment of health risks associated with ambient air pollution. The research results give an opportunity to solve a practical task related to informing the population about health risks and to overcome a so-called language barrier between experts and ordinary people. For example, messages aimed for decision-makers can be adapted considering all the identified perception peculiarities. © Barg А.О., Lebedeva-Nesevrya N.А., Kornilitsyna М.D., 2022","Health risk; Informing; Probability assessment; Probability of risk realization; Risk assessment; Risk perception; Risk rate; Subjective risk assessment","","","Scopus"
506,"10.3390/atmos9070270","Online Questionnaire as a Tool to Assess Symptoms and Perceived Indoor Air Quality in a School Environment","Järvi, K; Vornanen-Winqvist, C; Mikkola, R; Kurnitski, J; Salonen, H",2018,"ATMOSPHERE","9","7","School environments are a complex entirety where various different exposure factors are related that contribute to the indoor air quality (IAQ) and may affect occupants' health and well-being. Indoor air questionnaires are useful for collecting information about the occupants' experiences and perceptions of the indoor air and for evaluating the results of the measures taken. A common way to implement health questionnaires is to ask the respondents to describe symptoms at certain time points, such as weeks or months. The aim of our study was to develop a short and easy online questionnaire to assess symptoms and perceived IAQ. We also aimed to test the usability of the questionnaire in school buildings and assess the differences between the online measurement data (CO2, T, and RH) and the IAQ complaints and symptoms reported by the pupils. A total of 105 teachers and 1268 pupils in 36 classrooms at six schools answered the questionnaires over a two-week period. The participants completed the questionnaire always after the lesson in the studied classroom. We received 719 answers from the teachers and 6322 answers from the pupils. The results demonstrated that the teachers reported more IAQ problems and symptoms than the pupils did. Differences between classrooms were observed in both the IAQ problem and reference schools. The most common significant differences (p-value > 0.05) between the classrooms were among humidity, too cold air, and stuffy air, and among symptoms, dry/sore throat, tiredness, headache, and skin symptoms. Maximum values of CO2 measurements and the highest prevalence of stuffy air were relatively consistent. The testing process demonstrated that such a questionnaire was suitable for adults and children aged at least 12 years. The results of our study suggest that a quick and easy online questionnaire that is completed within a short period may be useful for gathering valuable knowledge about perceived IAQ. It could be used in combination with other indoor environment investigations to produce detailed results and restorative measures.","indoor air; health questionnaire; symptoms; pupils; teachers","Air quality; Carbon dioxide; Health; Indoor air pollution; Teaching; Indoor air; Indoor air quality; Indoor environment; On-line measurement data; Online questionnaire; Pupils; Symptoms; Teachers; air quality; health survey; indoor air; questionnaire survey; student; symptom; Surveys","RESPIRATORY SYMPTOMS; ELEMENTARY-SCHOOLS; HEALTH SYMPTOMS; VENTILATION RATES; MOISTURE DAMAGE; CHILDREN; ASTHMA; DAMPNESS; ASSOCIATIONS; PERFORMANCE","WOS"
74,"10.1016/S0015-1882(06)70972-7","Opinion: Air pollution - the next generation","Mcilvaine, B",2006,"FILTRATION & SEPARATION","43","8","Pollution and filtration analyst Bob Mcilvaine casts his eye over the air pollution industry, and speculates as to what will influence the market over the coming years. © 2006 Elsevier Ltd. All rights reserved.","","Air pollution; Filtration; Marketing; Filtration; Marketing; Pollution industry; Air pollution","","WOS"
619,"10.5194/acp-22-4801-2022","Opinion: Insights into updating Ambient Air Quality Directive 2008/50/EC","Kuula, J; Timonen, H; Niemi, JV; Manninen, HE; Rönkkö, T; Hussein, T; Fung, PL; Tarkoma, S; Laakso, M; Saukko, E; Ovaska, A; Kulmala, M; Karppinen, A; Johansson, L; Petäjä, T",2022,"ATMOSPHERIC CHEMISTRY AND PHYSICS","22","7","As evidence of adverse health effects due to air pollution continues to increase, the World Health Organization (WHO) recently published its latest edition of the global air quality guidelines (World Health Organization, 2021). Although not legally binding, the guidelines aim to provide a framework in which policymakers can combat air pollution by formulating evidence-based air quality management strategies. In the light of this, the European Union has stated its intent to revise the current ambient air quality directive (2008/50/EC) to more closely resemble the newly published WHO guidelines (European Commission, 2020). This article provides an informed opinion on selected features of the air quality directive that we believe would benefit from a reassessment. The selected features include discussion about (1) air quality sensors as a part of a hierarchical observation network, (2) the number of minimum sampling points and their siting criteria, and (3) new target air pollution parameters for future consideration.","","air quality; atmospheric pollution; European Union; health impact; public health; sensor; World Health Organization","","WOS"
99,"10.1016/j.buildenv.2024.111645","Perceived air quality (PAQ) assessment methods in office buildings: A systematic review towards an indoor smellscape approach","Torriani, G; Torresin, S; Lara-Ibeas, I; Albatici, R; Babich, F",2024,"BUILDING AND ENVIRONMENT","258","","Indoor air quality (IAQ) has significant impacts on office occupants' productivity, well-being and health. Addressing IAQ not only means ensuring that contaminants are below harmful concentration but also that people exposed are satisfied. However, current standards often lack clear metrics and thresholds dedicated to Perceived Air Quality (PAQ). Therefore, it is important to examine whether there is a prevalent method in the literature that could lead towards standardization. This review study constitutes the first comprehensive critical exploration of the subject. Adopting the PRISMA (Preferred Reporting Items for Systematic Reviews and Meta- Analyses) guidelines, the objective is to synthesize and compare diverse methods (subjective vs instrumental evaluations; object of judgment; component of perception; rating scales) for assessing PAQ in office buildings, based on insights from 93 field and laboratory studies. Results show that the assessment of PAQ predominantly relies on questionnaires (90 %), with a very smaller percentage using alternative methods such as olfactory indices, diaries, interviews, sensory testing, and text mining techniques. Workers' satisfaction is the most commonly evaluated aspect in PAQ questionnaires, often measured on a 7-point Likert scale. Odours are typically characterized in terms of intensity by utilizing a continuous 6-point unidirectional scale. Olfactory stimuli are usually considered with a negative connotation, being the absence of odour the target of IAQ design. The present study proposes a future research agenda that introduces the importance of a perceptual approach to evaluate the indoor olfactory environments (or smellscapes), aiming to create working spaces that are not only odour-neutral but also olfactorily pleasant.","Indoor environmental quality; Odour; Office buildings; Perceived air quality; Smellscape","Air quality; Indoor air pollution; Odors; 'current; Air quality assessment; Diverse methods; Indoor air quality; Indoor environmental quality; Meta-analysis; Perceived air quality; Smellscape; Systematic Review; Well being; air quality; building; environmental assessment; environmental quality; indoor air; literature review; odor; Office buildings","LEED-CERTIFIED BUILDINGS; ENVIRONMENTAL-QUALITY; OCCUPANT SATISFACTION; SBS SYMPTOMS; DISPLACEMENT VENTILATION; GENDER-DIFFERENCES; USER SATISFACTION; WORK PERFORMANCE; COMFORT; IMPACT","WOS"
