,DOI,Title,Authors,Year,Source Title,Volume,Issue,Abstract,Author Keywords,Scopus Keywords,WOS Keywords,Source
270,10.3390/ijerph14020116,Racial Differences in Perceptions of Air Pollution Health Risk: Does Environmental Exposure Matter?,"Chakraborty, J; Collins, TW; Grineski, SE; Maldonado, A",2017,INTERNATIONAL JOURNAL OF ENVIRONMENTAL RESEARCH AND PUBLIC HEALTH,14.0,2,"This article extends environmental risk perception research by exploring how potential health risk from exposure to industrial and vehicular air pollutants, as well as other contextual and socio-demographic factors, influence racial/ethnic differences in air pollution health risk perception. Our study site is the Greater Houston metropolitan area, Texas, USAa racially/ethnically diverse area facing high levels of exposure to pollutants from both industrial and transportation sources. We integrate primary household-level survey data with estimates of excess cancer risk from ambient exposure to industrial and on-road mobile source emissions of air toxics obtained from the U.S. Environmental Protection Agency. Statistical analysis is based on multivariate generalized estimation equation models which account for geographic clustering of surveyed households. Our results reveal significantly higher risk perceptions for non-Hispanic Black residents and those exposed to greater cancer risk from industrial pollutants, and also indicate that gender influences the relationship between race/ethnicity and air pollution risk perception. These findings highlight the need to incorporate measures of environmental health risk exposure in future analysis of social disparities in risk perception.",risk perception; air pollution; cancer risk; race; ethnicity; Houston,,LONGITUDINAL DATA-ANALYSIS; WHITE MALE; PERCEIVED RISK; CLIMATE-CHANGE; CANCER-RISKS; GENDER; RACE; HOUSTON; EXPERIENCE; QUALITY,WOS
323,10.3390/su152416713,Regional Differences in Willingness to Pay for Mitigation of Air Pollution from Coal-Fired Power Plants in South Korea,"Li, DT; Rishi, M; Bae, JH",2023,SUSTAINABILITY,15.0,24,"This study examined whether people who reside in different regions of South Korea exhibit different WTP for the mitigation of PM2.5 emissions from coal-fired power plants by restricting their operation during the winter and spring when air pollution becomes severe. The eastern portions of the country are relatively insulated from the harmful effects of PM2.5 emissions due to northwest winds which cause air pollutants generated from coal-fired power plants to be carried out to the East Sea (Sea of Japan). Consequently, our sample group was divided into central, western, eastern, and southern regions, and a contingent valuation method, combined with a double-bounded dichotomous choice, was used to derive people's WTP for the mitigation of PM2.5 emissions. Our estimation results indicated that respondents who live in eastern regions showed a significantly lower WTP (about KRW 1280/month) than the mean WTP of other regions (above KRW 1337/month). Thus, we suggest that the current Seasonal Management System of PM2.5 emissions should be modified to consider regional differences. Statistical results from this study reinforce our suggestions-almost 78 percent of survey respondents support a revision of the current SMS policy and are in favor of a revised SMS policy-one that exempts eastern regions from a nationwide shutdown of coal-fired generation from December to March. Exempting coal-fired power plants in eastern regions from the Seasonal Management System might result in significant fiscal savings without a corresponding increase in nationwide PM2.5 concentrations.",PM2.5 emissions; regional difference; contingent valuation method; willingness to pay; coal-fired power plants,South Korea; atmospheric pollution; coal-fired power plant; contingent valuation; fiscal policy; particulate matter; willingness to pay,DICHOTOMOUS CHOICE; CONTINGENT VALUATION; QUALITY; EFFICIENCY,WOS
122,10.1016/j.trd.2021.102723,"Relationships among haze pollution, commuting behavior and life satisfaction: A quasi-longitudinal analysis","Wang, XQ; Yin, CY; Shao, CF",2021,TRANSPORTATION RESEARCH PART D-TRANSPORT AND ENVIRONMENT,92.0,,"The effects of air pollution and commuting behavior on life satisfaction have received increasing research interests. However, the literature pays scant attention to haze pollution and its moderating effects on the relationship between commuting behavior and life satisfaction. Using two round of cross-sectional survey data across 92 Chinese cities, this paper analyzes the impacts of haze pollution and commuting behavior on life satisfaction, and the moderating effects of haze pollution on the link between commuting behavior and life satisfaction. The findings suggest that haze pollution and its changes are important triggers of life satisfaction. Moreover, the effects of changes in haze pollution correlate with basic haze pollution levels. Active commuters report higher life satisfaction, while transit commuters report lower life satisfaction. Longer commutes cause losses in life satisfaction. Additionally, haze pollution mitigates the losses in life satisfaction for commuters using public transit, but strengthens the negative effect of commuting time.",Life satisfaction; Haze pollution; Commuting behavior; Moderating effect; Multilevel model,China; Environmental impact; Mechanical engineering; Transportation; Chinese cities; Commuting time; Cross-sectional surveys; Haze pollutions; Longitudinal analysis; Moderating effect; Public transit; Research interests; atmospheric pollution; commuting; haze; life satisfaction; longitudinal gradient; public transport; travel behavior; Pollution,MULTISCALE BUILT ENVIRONMENT; LIGHT RAIL TRANSIT; AIR-POLLUTION; MODE CHOICE; TRAVEL MODE; URBANIZING CHINA; HEALTH IMPACTS; HAPPINESS; QUALITY; INCOME,WOS
21,10.1007/s11270-021-05197-x,Research on Analysis of Evaluation Influence Factors of Air Quality Opinions Sentiment Value and Quantification Method,"Min, J; Han, YX; Sun, Y; Jin, FX; Li, T",2021,WATER AIR AND SOIL POLLUTION,232.0,7,"More and more people make opinions on air quality on social media, as science develops and the seriousness of air quality issues. Studies on sentiment analysis keyed to this kind of public opinions will do help in the introduction and perfection of policy of air quality. The evaluation of opinions sentiment is still a hard point in at this stage. There are only a few researches about the factors of the value of opinions sentiment. This article uses opinions related to air quality from Sina Weibo (Chinese Twitter) users, by online questionnaire surveys, and studies the results of opinions sentiment value about air quality in different groups, aiming at doing a research on the evaluation influence factors of opinions sentiment value on air quality. Furthermore, we came up with a solution synthesizing the influential level to calculate opinions sentiment value. We found amounts of respondents had a negative attitude to the opinions. We can now say with some confidence that education is the most significant influence factor on the public to tell the degree of sentiment level of air quality opinions. The sentiment calculation method where we come up could reduce the one-sidedness of different individuals' evaluations of the same opinion to some extent. The research could be reference for air quality management from the perspective of public opinion sentiment analysis.",Air quality perception; Social media; Opinion mining; Sentiment analysis; Public perceptions,,MORTALITY; HEALTH,WOS
291,10.3390/ijerph182212115,"Research on Public Environmental Perception of Emotion, Taking Haze as an Example","Bao, Q; Zhang, XJ; Wu, XJ; Zhang, Q; Chen, JS",2021,INTERNATIONAL JOURNAL OF ENVIRONMENTAL RESEARCH AND PUBLIC HEALTH,18.0,22,"Ecological and environmental problems have become increasingly prominent in recent years. Environmental problems represented by haze have become a topic that affects the harmonious ecology of human beings. The trend of this topic is on the rise. People's perception of the environment after the impact of haze has also changed. A real-time grasp of the dynamic public environment perception of emotions is often an important basis for environmental management departments to effectively solve environmental problems through public opinion. This article focuses on the problem of the public perception of emotional changes, which is caused by fog and hazy weather, proposes an environmental emotion perception model, using Weibo comment data about fog and haze as environmental perception data, and analyzes the impact of fog and haze on the public in four seasonal time dimensions. The post-environment perception of emotion changes: the results show that in spring, the public's environmental perception of emotions is mainly negative emotions at the beginning of the season; in summer, positive emotions become dominant emotions; in autumn, the public's environmental perception of emotions is dominated by negative emotions that increase substantially; and in winter, the dominant environmental perception of emotions of the public is still negative. This theory provides support for research on social emotions and public opinion behavior.",convolutional neural network; environmental perception of emotion; weighted networks; deep learning,,,WOS
70,10.1016/j.envres.2019.108751,"Residential surrounding green, air pollution, traffic noise and self-perceived general health","Klompmaker, JO; Janssen, NAH; Bloemsma, LD; Gehring, U; Wijga, AH; van den Brink, C; Lebret, E; Brunekreef, B; Hoek, G",2019,ENVIRONMENTAL RESEARCH,179.0,,"Self-perceived general health (SGH) is one of the most inclusive and widely used measures of health status and a powerful predictor of mortality. However, only a limited number of studies evaluated associations of combined environmental exposures on SGH. Our aim was to evaluate associations of combined residential exposure to surrounding green, air pollution and traffic noise with poor SGH in the Netherlands. We linked data on long-term residential exposure to surrounding green based on the Normalized Difference Vegetation Index (NDVI) and a land-use database (TOP10NL), air pollutant concentrations (including particulate matter (PM10, PM2.5), and nitrogen dioxide (NO2)) and road- and rail-traffic noise with a Dutch national health survey, resulting in a study population of 354,827 adults. We analyzed associations of single and combined exposures with poor SGH. In single-exposure models, NDVI within 300 m was inversely associated with poor SGH [odds ratio (OR) = 0.91, 95% CI: 0.89, 0.94 per IQR increase], while NO2 was positively associated with poor SGH (OR = 1.07, 95% CI: 1.04, 1.11 per IQR increase). In multi-exposure models, associations with surrounding green and air pollution generally remained, but attenuated. Joint odds ratios (JOR) of combined exposure to air pollution, rail-traffic noise and decreased surrounding green were higher than the odds ratios of single-exposure models. Studies including only one of these correlated exposures may overestimate the risk of poor SGH attributed to the studied exposure, while underestimating the risk of combined exposures.",NDVI; NO2; PM2.5; Traffic noise; General health; Joint odds ratio,,LONG-TERM EXPOSURE; USE REGRESSION-MODELS; RATED HEALTH; PROSPECTIVE COHORT; DIABETES-MELLITUS; PHYSICAL-ACTIVITY; MORTALITY; ASSOCIATIONS; ENVIRONMENTS; DEPRESSION,WOS
262,10.3390/app9183660,"Residents' Perceptions of and Response Behaviors to Particulate Matter-A Case Study in Seoul, Korea","Cho, ME; Kim, MJ",2019,APPLIED SCIENCES-BASEL,9.0,18,"This study is interested in understanding the particulate matter perceptions and response behaviors of residents. The purpose of this study was to identify indoor air quality along with the response behaviors of residents in Seoul, to ascertain whether there is a difference in behaviors when particulate matter is present, according to the characteristics of residents and to grasp the nature of this difference. A questionnaire survey of 171 respondents was conducted. The questionnaire measured the indoor air quality perceived by residents, the health symptoms caused by particulate matter, residents' response behaviors to particulate matter and the psychological attributes affecting those response behaviors. Residents of Seoul were divided into college students in their twenties, male workers in their thirties and forties and female housewives in their thirties and forties. The data were calibrated by SPSS 23 using a one-way analysis of variance (ANOVA) and multiple regression analyses. The results show that most people found particulate matter to be an important problem but were unable to do sufficient mitigation action to prevent its presence. Residents showed greater psychological stress resulting in difficulty going out than physical symptoms. The most influential factor on response behaviors was psychological attributes. Participants were aware of the risks of particulate matter but believed it to be generated by external factors; thus, they felt powerless to do anything about it, which proved to be an obstacle to response behaviors.",particulate matter; perception; response behavior; psychological attribute,,ADAPTATION; MITIGATION; CLIMATE,WOS
51,10.1016/j.buildenv.2023.110775,Restaurant managers knowledge and intention to improve building ventilation and indoor air quality using control measures in a middle-income country,Lee J.Y.; Aghamohammadi N.,2023,,244.0,,"Transmission of SARS-CoV-2 virus can occur via aerosol in inadequately ventilated indoor spaces, including restaurants. Despite the introduction of guidelines to ensure good indoor air quality (IAQ) and ventilation, business owners in low- or middle-income countries (LMIC) remain unsure about the regulations. This study aims to evaluate the level of knowledge and intention to improve IAQ and building ventilation among restaurant managers, and whether it is reflective of the implementation of control measures during COVID-19. This cross-sectional study involved restaurants from eight study sites at Kuala Lumpur, Malaysia, selected using cluster randomised sampling. A survey was conducted using a questionnaire adapted from the guidance note on ventilation and IAQ for non-residential setting during the COVID-19 pandemic by the Department of Occupational Safety and Health, Malaysia. Data collected were analysed using Statistical Package for the Social Sciences, version 27. Low knowledge level (median score: 4, range: 1–7) and moderate intention level (median score: 6, range 2–8) were reported among restaurant managers; however, the level of knowledge and intention were not correlated with the implementation of control measures. Insights from this study will be useful in informing the authorities to assess and review the practicality of current standard operating procedures and guidelines. The study findings are also expected to be translated to other airborne infectious diseases to increase the country's preparedness in managing future pandemics. © 2023 Elsevier Ltd",Buildings; Indoor air quality; Infectious disease; Intention; Knowledge; Ventilation,Kuala Lumpur [West Malaysia]; Malaysia; West Malaysia; Air quality; Coronavirus; COVID-19; Occupational risks; Ventilation; Building ventilations; Control measures; Indoor air quality; Indoor space; Infectious disease; Intention; Knowledge; Malaysia; Middle-income countries; Ventilation airs; air quality; COVID-19; food industry; indoor air; infectious disease; knowledge; safety; ventilation; Quality control,,Scopus
285,10.3390/ijerph17176424,Risk Perception of Air Pollution: A Systematic Review Focused on Particulate Matter Exposure,"Cori, L; Donzelli, G; Gorini, F; Bianchi, F; Curzio, O",2020,INTERNATIONAL JOURNAL OF ENVIRONMENTAL RESEARCH AND PUBLIC HEALTH,17.0,17,"The adverse health effects of exposure to air pollutants, notably to particulate matter (PM), are well-known, as well as the association with measured or estimated concentration levels. The role of perception can be relevant in exploring effects and pollution control actions. The purpose of this study was to explore studies that analyse people's perception, together with the measurement of air pollution, in order to elucidate the relationship between them. We conducted a systematic review in accordance with the Preferred Reporting Items for Systematic Reviews and Meta-Analyses (PRISMA) guidelines. In March 2020, PubMed, EMBASE, and Scopus databases were explored in an attempt to search for studies published from 2000 to 2020. The review included 38 studies, most of which were conducted in China (n= 13) and the United States (n= 11) and published over the last four years (n= 26). Three studies were multicenter investigations, while five articles were based on a national-level survey. The air quality (AQ) was assessed by monitoring stations (n= 24) or dispersion models (n= 7). Many studies were population questionnaire-based, air monitoring and time-series studies, and web-based investigations. A direct association between exposure and perception emerged in 20 studies. This systematic review has shown that most of the studies establish a relationship between risk perception measurement. A broad spectrum of concepts and notions related to perception also emerged, which is undoubtedly an indicator of the wealth of available knowledge and is promising for future research.",air pollution exposure; particulate matter (pm); environmental epidemiology; environmental pollution; perception; risk perception; public health policy; systematic review,,QUALITY PERCEPTION; PUBLIC PERCEPTION; HEALTH; DETERMINANTS; POLICY; AREAS; CHINA; ASSOCIATION; ENVIRONMENT; PEDESTRIANS,WOS
263,10.3390/atmos11060600,"Risk Perception on Haze Pollution and Willingness to Pay for Self-Protection and Haze Management in Chiang Mai Province, Northern Thailand","Sereenonchai, S; Arunrat, N; Kamnoonwatana, D",2020,ATMOSPHERE,11.0,6,"Air pollution is an important environmental health risk that affects people worldwide, including those in the Chiang Mai Province, Northern Thailand. A questionnaire survey based on accidental sampling to explore risk perception and willingness to pay (WTP) for self-protection and haze management was conducted via face-to-face interview of 250 households, in one urban and four rural areas (covering one rural plain and three different levels of highland areas). Data were analyzed using the contingent valuation method, a one-way ANOVA, correlation, and stepwise multiple linear regression. Key findings on risk perception found that urban respondents living in the lowest areas were more familiar with and experienced more effects from serious haze, while having the least trust in the local authority's management to cope with the situation. Influential factors determining familiarity and effect for people in most areas were their harm and severe haze experiences. Comparing WTP for a mask, an air purifier, and local authorities support, respondents in all areas were mainly willing to pay for a mask; this was influenced by various factors. The highest average price of willingness to pay was found in the urban area. The important significant factors that increased WTP for self-protection of urban respondents was severe haze experience, while rural respondents who had a longer stay duration, including married farmers in highland areas with less education, tended to have less WTP for self-protection but more WTP for haze management. Avoiding crop residue burning is the first strategy that should be used to deal with haze pollution. Early burning schedules of the highland people should be formally announced, and prompt risk communication should be implemented by local and central authorities and media practitioners.",risk perception; haze pollution; willingness to pay; self-protection; haze management; Thailand,,AIR-POLLUTION; CONTINGENT VALUATION; MITIGATION; QUALITY; DETERMINANTS; CHINA,WOS
276,10.3390/ijerph15081728,"Risk Reduction Behaviors Regarding PM2.5 Exposure among Outdoor Exercisers in the Nanjing Metropolitan Area, China","Xiong, LL; Li, J; Xia, T; Hu, XY; Wang, Y; Sun, MN; Tang, M",2018,INTERNATIONAL JOURNAL OF ENVIRONMENTAL RESEARCH AND PUBLIC HEALTH,15.0,8,"Aims: This study aimed to describe risk reduction behaviors regarding ambient particulate matter with a diameter of 2.5 m or less (PM2.5) among outdoor exercisers and to explore potential factors influencing those behaviors in the urban area of Nanjing, China. Method: A cross-sectional convenience sample survey was conducted among 302 outdoor exercisers in May 2015. Descriptive analysis was used to describe demographics, outdoor physical activity patterns, knowledge of PM2.5 and risk reduction behaviors. Multivariate logistic regression analysis was then used to explore factors that influence the adoption of risk reduction behaviors. Results: The most common behavior to reduce PM2.5 exposure was minimizing the times for opening windows on hazy days (75.5%), and the least common one was using air purifiers (19.3%). Two thirds of respondents indicated that they wore face masks when going outside in the haze (59.5%), but only 13.6% of them would wear professional antismog face masks. Participants adopting risk reduction behaviors regarding PM2.5 exposure tended to be females, 50-60 year-olds, those with higher levels of knowledge about PM2.5 and those who had children. Conclusions: These findings indicate the importance of improving knowledge about PM2.5 among outdoor exercisers. Educational interventions should also be necessary to guide the public to take appropriate precautionary measures when undertaking outdoor exercise in high PM2.5 pollution areas.",risk reduction behavior; PM2.5; outdoor exercisers; influencing factors; China,,POLYCYCLIC AROMATIC-HYDROCARBONS; AIR-POLLUTION; PARTICULATE MATTER; INDIVIDUAL EXPOSURE; HEALTH-RISKS; LUNG-CANCER; MORTALITY; INDOOR; HAZE; ASSOCIATION,WOS
19,10.1007/s11166-005-1155-0,"Risk perceptions and value of a statistical life for air pollution and traffic accidents: Evidence from Bangkok, Thailand","Vassanadumrongdee, S; Matsuoka, S",2005,JOURNAL OF RISK AND UNCERTAINTY,30.0,3,"This paper presents results of two contingent valuation surveys conducted in Bangkok measuring individuals' willingness to pay (WTP) to reduce mortality risk arising from two risk contexts: air pollution traffic accidents Results from the risk perception survey disclose that respondents view the two risks differently. WTP to reduce air pollution risk is influenced by degrees of dread, severity, controllability and personal exposure, while WTP to reduce traffic accident risk is influenced by perceived immediate occurrence. Nevertheless, the value of a statistical life (VSL) for both air pollution and traffic accidents are comparable (US$0.74 to $1.32 million and US$0.87 to $1.48 million, respectively). This indicates that the risk perception factor alone has little impact on the VSL, a finding similar to previous studies using program choice indifferences.",contingent valuation; value of statistical life; willingness-to-pay; air pollution; road traffic accident; developing country,,WILLINGNESS-TO-PAY; CONTINGENT VALUATION; MORTALITY RISK; HEALTH; SAFETY; CHOICE; TRANSPORT; GOODS; AGE,WOS
90,10.1016/j.jclepro.2020.125735,"Roles of socio-physical environments on air quality control policy with respect to knowledge, attitude and intention","Nguyen, KLP; Chuang, YH; Yu, RF; Chen, CY; Chen, HW",2021,JOURNAL OF CLEANER PRODUCTION,288.0,,"Human behavior altered in different socioeconomic conditions is the main contributor to deteriorating air quality, therefore changing the behavior is the goal of air policies. In this study, we propose an integrated framework to figure out the roles of socio-physical environments in promoting air quality control policies through behavioral perspectives. The study selects Changhua County in Central Taiwan, composed of 26 cities and townships, as a case study to investigate the impacts of social and economic factors and the air quality on individual's knowledge, attitude and behavioral intention. The socioeconomic and environmental factors are collected from Taiwanese official information, while the knowledge, attitude, and intention toward the policies are obtained through questionnaires. Subsequently, multivariate analysis techniques including principal component analysis and redundancy analysis are utilized to simultaneously identify the causal relationships between socio-physical environments and the knowledge, attitude, and intention in different townships. Our findings suggest that individual's knowledge, attitude, and intention toward the air polices cannot be raised simply in commensurate with the growth of the economy and the deterioration of air quality. Indeed, people living in highly urbanized regions and being well-educated, particularly in Changhua City, are less willing to take actions for air quality improvement although they are susceptible to environmental risks. On the contrary, people close to nature have more environmental knowledge, positive attitudes and more intentions to improve the air quality. The finding results will be beneficial to authorities in each city/township to organize environmental education plans corresponding to their socioeconomic conditions and behavioral patterns. (C) 2021 Elsevier Ltd. All rights reserved.",Redundancy analysis; Air quality control policy; Social and economic context; Determinants of health; VOCs; Pro-environmental behavior,,,WOS
348,,"SURVEY OF RESIDENTS' PERCEPTIONS AND CONCERNS ON AIR POLLUTION IN MAHARASHTRA, INDIA","Sanjeev, S; Balu, S",2024,VALUE IN HEALTH,27.0,6,,,,,WOS
