,DOI,Title,Authors,Year,Source Title,Volume,Issue,Abstract,Author Keywords,Scopus Keywords,WOS Keywords,Source
63,10.1016/j.enpol.2018.02.025,Does public opinion affect air quality? Evidence based on the monthly data of 109 prefecture-level cities in China,"Zhang, SL; Li, Y; Hao, Y; Zhang, YP",2018,ENERGY POLICY,116.0,,"In recent years, serious smog and haze have shrouded vast areas of northern and eastern China, which has drawn broad attention at home and abroad. Although China is an authoritarian country with strict media control, public opinion may still affect air quality by putting pressure on the local and central governments to enhance environmental protections. In this paper, the impact of public opinion on air quality in China is for the first time quantitatively examined. Specifically, the monthly average levels of the Air Quality Index (AQI) and the concentrations of several main air pollutants, such as PM2.5, PM10 and SO2, are utilized as indicators for air quality. Using a dataset consisting of 109 prefecture-level Chinese cities for the period between November 2013 and October 2016, the estimation results indicate that air pollution significantly affects public opinion on air quality, and the surge in public opinion on air pollution occurs more frequently in the winter. Public opinion seems to have a positive effect on the environment only in the short run: air quality tends to improve two months after the surge in negative public opinion. In general, public opinion about air pollution helps to improve air quality in China.",Public opinion; Air quality; Prefecture-level cities; China,,WILLINGNESS-TO-PAY; ECONOMIC-DEVELOPMENT; POLLUTION; PM2.5; MEDIA; COMMUNICATION; CENSORSHIP; EXPOSURE; IMPACT; GROWTH,WOS
92,10.1016/j.jclepro.2021.128477,Does the public haze pollution concern expressed on online platforms promoted pollution control? - Evidence from Chinese online platforms,"Wu, WQ; Wang, WW; Zhang, L; Wang, QY; Wang, LJ; Zhang, M",2021,JOURNAL OF CLEANER PRODUCTION,318.0,,"With the continuous deterioration of haze pollution and the increasing public awareness of environmental protection, more and more netizens are paying attention to the problem of haze pollution on online platforms, expressing environmental demands, supervising and accusing corporate pollution. Environmental concerns expressed by netizens on social media platforms exert strong public pressure on polluting enterprises with the popularity of smart phones. In this paper, a dynamic spatial econometric model is used to study the effects of network demand intensity on environmental pollution, taking into account the endogenous, regional differences and spatial spillover effects of explanatory variables. The total number of posts, likes, retweets, and comments on Weibo with the predefined search terms haze and the number of Baidu index comprised the public concern. Geographical detector model confirmed that the public's concern about haze pollution expressed on new media is closely related to haze condition. The results showed that new media network public opinion can alleviate haze pollution, but there are significant regional differences. From a regional point of view, the inhibition effect of new media network public opinion on haze pollution was the most significant in the central region, but it was not significant in the eastern and western regions. In addition, haze pollution showed obvious cumulative effect characteristics in the time dimension, and spillover effect characteristics in the space dimension.",New media network public opinion; Haze pollution; Spatial statistic model,,PANEL-DATA; PERFORMANCE,WOS
24,10.1007/s11356-020-08301-6,"Economic losses and willingness to pay for haze: the data analysis based on 1123 residential families in Jiangsu province, China","Wu, XH; Guo, J; Wei, G; Zou, Y",2020,ENVIRONMENTAL SCIENCE AND POLLUTION RESEARCH,27.0,15,"Haze pollution is a key obstacle for environmental management faced by China and many other developing countries. The survey on residential families' economic losses and willingness to pay (WTP) are regarded as an essential reference for the implementation of environmental policies for haze treatment. For Jiangsu province of China, the authors of this paper first conducted three qualitative interviews with respectively meteorologists, meteorological administrators, and residents, a questionnaire was then elaborately designed, and subsequent surveys of 1123 families were administered in Jiangsu province. Further, the authors investigated measurements of direct economic losses by using the contingent valuation method (CVM) and explored influential factors of WTP by utilizing the binary logistic regression. From this survey, the estimated total economic loss incurred by haze disasters and total treatment cost for haze-related diseases were respectively 22.38 billion (in RMB) and 8.4 billion for Jiangsu province. 55.9% of residential families were willing to pay 11.6 billion RMB annually (51.97% of total loss) for haze treatment, leaving a shortage of 11.05 billion RMB, which the government is responsible to pay. These findings provide empirical information reflecting the opinions of communities and residential families, useful for the governments and industrial sectors to design environmental policies to meet the requirements of the public and control environmental pollution in an effective way to achieve sustainable development.",Environmental pollution; Economic loss; Willingness to pay; Contingent valuation method; Haze,,AIR-POLLUTION; CONTINGENT VALUATION; HEALTH IMPACTS; PM2.5; MANAGEMENT; MALAYSIA; QUALITY; MODEL,WOS
236,10.17151/luaz.2021.52.3,"Economic valuation and social perception of air pollution in Villavicencio, Colombia; [Valoración económica y percepción social de la contaminación atmosférica en Villavicencio, Colombia]",González-Pérez A.; Ariza-Marín L.J.,2021,,52.0,,"This study aimed at determining the social perception and the economic value of the effects caused by air pollution on the health of the inhabitants in five sectors of Villavicencio, Colombia. Through the Benefit Transfer method of the Willingness to Pay (WP) and 400 semi-structured surveys, a total of COP$5.842 million was obtained to reduce the air pollution annually in the city which could, through decontamination strategies, get to avoid 6,318 cases of respiratory affectation and 73,455 annual cases of Acute Respiratory Infection (ARI) of which 28,168 correspond to children under 5 years of age. Likewise, more than 60% of the population perceives the air quality in the city as fair and 98% considered that it affects quality of life. More than 59% recognize transportation systems as the main air pollution problem, and it was identified that citizens have a little environmental empowerment since 79% of the population does not identify the environmental authority in charge, nor do they recognize any monitoring and control measures. The results allowed corroborating the impact that the inhabitants perceive due to air pollution in addition to recognizing that the most important element of citizen participation is failing, which can be used efficiently to achieve actions within public policy and improve the environmental condition of the city. ©Universidad de Caldas.",Air quality; citizen participation; economic valuation of the environment; environmental policy,,,Scopus
266,10.3390/en14020333,"Effect of Thermal, Acoustic and Air Quality Perception Interactions on the Comfort and Satisfaction of People in Office Buildings","Bourikas, L; Gauthier, S; En, NKS; Xiong, PY",2021,ENERGIES,14.0,2,"Current research on human comfort has identified a gap in the investigation of multi-domain perception interactions. There is a lack of understanding the interrelationships of different physio-socio-psychological factors and the manifestation of their contextual interactions into cross-modal comfort perception. In that direction, this study used data from a post occupancy evaluation survey (n = 26), two longitudinal comfort studies (n = 1079 and n = 52) and concurrent measurements of indoor environmental quality factors (one building) to assess the effect of thermal, acoustic and air quality perception interactions on comfort and satisfaction of occupants in three mixed-mode university office buildings. The study concluded that thermal sensation (TSV) is associated with both air quality (ASV) and noise perception (NSV). The crossed effect of the interaction of air quality and noise perception on thermal sensation was not evident. The key finding was the significant correlation of operative temperature (T-op) with TSV as expected, but also with noise perception and overall acoustic comfort. Regarding the crossed main effects on thermal sensation, a significant effect was found for the interactions of (1) T-op and (2) sound pressure levels (SPL30) with air quality perception respectively. Most importantly, this study has highlighted the importance of air quality perception in achieving occupants' comfort and satisfaction with office space.",human thermal perception; comfort; multi-domain interactions; indoor air quality; noise sensation; cross-modal perception,,USER SATISFACTION; ENERGY USE; ENVIRONMENT; HEALTH; PERFORMANCE; DESIGN,WOS
22,10.1007/s11356-017-1034-7,Effectiveness of a theory-based mobile phone text message intervention for improving protective behaviors of pregnant women against air pollution: a randomized controlled trial,"Jasemzadeh, M; Khafaie, MA; Jaafarzadeh, N; Araban, M",2018,ENVIRONMENTAL SCIENCE AND POLLUTION RESEARCH,25.0,7,"Health impact of exposure to air pollution is a public health concern. The aim of this study was to investigate an extended parallel process model (EPPM)-based mobile phone text message intervention for improving protective behaviors against air pollution among pregnant women. In this randomized controlled trial (IRCT2016102810804N8), 130 pregnant women were randomly assigned into either experimental or control groups. A valid and reliable questionnaire was used to collect data. Experimental group received mobile phone intervention on a daily basis for 2 months. Control group received usual care, only. Data were analyzed using SPSS 15 applying t test, chi-square, and Wilcoxon and Mann-Whitney U test. Although before intervention, there were no significant differences between different structures of EPPM (P > 0.05), after intervention, there were statistically significant differences between perceived severity, response efficacy, self-efficacy, and protective behaviors between two groups (P < 0.05). Implementing EPPM based-mobile phone intervention could promote protective behaviors against air pollution among pregnant women. The present study might be used as a framework for evidence-based health promotion regarding air pollution risk communication and self-care behaviors. Trial registration: IRCT2016102810804N8.",Extended parallel process model; Air pollution; Pregnancy; Protective behavior; Self-care; mHealth,,RESPIRATORY HEALTH; SELF-EFFICACY; EXPOSURE; CHILDREN; REDUCE; RISK,WOS
274,10.3390/ijerph15071414,Effects of Ventilation Improvement on Measured and Perceived Indoor Air Quality in a School Building with a Hybrid Ventilation System,"Vornanen-Winqvist, C; Salonen, H; Järvi, K; Andersson, MA; Mikkola, R; Marik, T; Kredics, L; Kurnitski, J",2018,INTERNATIONAL JOURNAL OF ENVIRONMENTAL RESEARCH AND PUBLIC HEALTH,15.0,7,"Ventilation system design and operation may significantly affect indoor air quality (IAQ). The aims of this case study were to investigate the functionality of a supply air fan-assisted hybrid ventilation system in a newly built school building with reported IAQ problems and to determine the effects of ventilation improvement on measured and perceived IAQ. The ventilation system function was researched simultaneously with IAQ measurements, with an analysis of total volatile organic compounds (TVOC), single volatile organic compounds (VOCs), and indoor mycobiota, and with questionnaires about perceived IAQ. At the baseline, an operational error of the ventilation system was found, which prevented the air from coming into the classrooms, except for short periods of high carbon dioxide (CO2) concentrations. After the ventilation operation was improved, a significant change in indoor mycobiota was found; the dominant, opportunistic human pathogenic species Trichoderma citrinoviride found in settled dust in the classroom before the improvement was no longer detected. In addition, the concentrations of CO2, TVOC, and some single VOCs, especially toluene and decamethylcyclopentasiloxane, decreased. The analysis of the questionnaire results indicated that the perceptions of unpleasant odors and stuffy air decreased, although a statistically significant improvement in perceived IAQ was not observed. The results provided evidence that the properly controlled hybrid ventilation system operating in mechanical supply mode provided adequate ventilation and was effective in decreasing the concentrations of some indoor-generated pollutants. With simple ventilation adjustments, microbiological exposure from building structures might be prevented.",ventilation; hybrid ventilation; indoor air quality; mycobiota; indoor air questionnaire; school building; Trichoderma citrinoviride,,NEW-YORK-STATE; TRICHODERMA-LONGIBRACHIATUM; SCIENTIFIC LITERATURE; MAMMALIAN-CELLS; ENVIRONMENTS; HEALTH; PERFORMANCE; SYMPTOMS; WORK; PEPTAIBOLS,WOS
108,10.1016/j.rser.2019.04.017,Effects of environmental policy on public risk perceptions of haze in Tianjin City: A difference-in-differences analysis,"Watanabe, R; Watanabe, T",2019,RENEWABLE & SUSTAINABLE ENERGY REVIEWS,109.0,,"In 2017, China enacted its most stringent command-and-control directive for regulating air pollution in major Chinese cities as part of the initiative to achieve the Air Pollution Prevention and Control Action Plan established by the government. This study explored the directive's effects on the public's risk perceptions of haze in the country. Specifically, we identified public views regarding haze-related risks, the factors that influence their perceptions, and the changes in such perceptions by administering questionnaires to residents of implementation and non-implementation areas in Tianjin City before and after six months-regulation application in the metropolis. The panel data obtained from the survey were then subjected to difference-in-differences analysis. Surprisingly, the analysis showed that the directive significantly reduced the public's perceptions of risk, even when we controlled for factors related to knowledge, attitudes, health conditions, and expectations from government governance of air pollution. This finding suggested that the evaluation of other control measures that prohibit all construction-related activities during winter and the subsequent formulation of optimal solution and clarification as to what constitutes sustainable energy usage. The external costs of such use should be considered in policy making.",Policy effect; Risk perception; Haze; Environmental sustainability; Difference-in-differences; China,,AIR-POLLUTION CONTROL; CLIMATE-CHANGE; SOCIAL TRUST; WINTER HAZE; QUALITY; ENERGY; CHINA; FARMERS; KNOWLEDGE; IMPACT,WOS
69,10.1016/j.envres.2019.108734,Effects of prenatal exposure to particulate matter air pollution on corpus callosum and behavioral problems in children,"Mortamais, M; Pujol, J; Martínez-Vilavella, G; Fenoll, R; Reynes, C; Sabatier, R; Rivas, I; Forns, J; Vilor-Tejedor, N; Alemany, S; Cirach, M; Alvarez-Pedrerol, M; Nieuwenhuijsen, M; Sunyer, J",2019,ENVIRONMENTAL RESEARCH,178.0,,"Objective: Air pollution (AP) may affect neurodevelopment, but studies about the effects of AP on the growing human brain are still scarce. We aimed to investigate the effects of prenatal exposure to AP on lateral ventricles (LV) and corpus callosum (CC) volumes in children and to determine whether the induced brain changes are associated with behavioral problems. Methods: Among the children recruited through a set of representative schools of the city of Barcelona, (Spain) in the Brain Development and Air Pollution Ultrafine Particles in School Children (BREATHE) study, 186 typically developing participants aged 8-12 years underwent brain MRI on the same 1.5 T MR unit over a 1.5-year period (October 2012-April 2014). Brain volumes were derived from structural MRI scans using automated tissue segmentation. Behavioral problems were assessed using the Strengths and Difficulties Questionnaire (SDQ) and the criteria of the Attention Deficit Hyperactivity Disorder DSM-IV list. Prenatal fine particle (PM2.5) levels were retrospectively estimated at the mothers' residential addresses during pregnancy with land use regression (LUR) models. To determine whether brain structures might be affected by prenatal PM2.5 exposure, linear regression models were run and adjusted for age, sex, intracranial volume (ICV), maternal education, home socioeconomic vulnerability index, birthweight and mothers' smoking status during pregnancy. To test for associations between brain changes and behavioral outcomes, negative binomial regressions were performed and adjusted for age, sex, ICV. Results: Prenatal PM2.5 levels ranged from 11.8 to 39.5 mu g/m(3) during the third trimester of pregnancy. An interquartile range increase in PM2.5 level (7 mu g/m(3)) was significantly linked to a decrease in the body CC volume (mm(3)) (beta = -53.7, 95%CI [-92.0, -15.5] corresponding to a 5% decrease of the mean body CC volume) independently of ICV, age, sex, maternal education, socioeconomic vulnerability index at home, birthweight and mothers smoking status during the third trimester of pregnancy. A 50 mm(3) decrease in the body CC was associated with a significant higher hyperactivity subscore (Rate Ratio (RR) = 1.09, 95%CI [1.01, 1.17) independently of age, sex and ICV. The statistical significance of these results did not survive to False Discovery Rate correction for multiple comparisons. Conclusions: Prenatal exposure to PM2.5 may be associated with CC volume decrease in children. The consequences might be an increase in behavioral problems.",Neuroimaging; Corpus callosum; Lateral ventricle; Behavioral problems; Air pollution; Children,,AUTISM SPECTRUM DISORDERS; SURFACE-BASED ANALYSIS; BRAIN WHITE-MATTER; GEOMETRICALLY ACCURATE; SEGMENTATION; GROWTH; SCHOOL; MRI; NEURODEVELOPMENT; NANOPARTICLES,WOS
189,10.1111/ina.12149,"Effects of ventilation rate per person and per floor area on perceived air quality, sick building syndrome symptoms, and decision-making","Maddalena, R; Mendell, MJ; Eliseeva, K; Chan, WR; Sullivan, DP; Russell, M; Satish, U; Fisk, WJ",2015,INDOOR AIR,25.0,4,"Ventilation rates (VRs) in buildings must adequately control indoor levels of pollutants; however, VRs are constrained by the energy costs. Experiments in a simulated office assessed the effects of VR per occupant on perceived air quality (PAQ), Sick Building Syndrome (SBS) symptoms, and decision-making performance. A parallel set of experiments assessed the effects of VR per unit floor area on the same outcomes. Sixteen blinded healthy young adult subjects participated in each study. Each exposure lasted four hours and each subject experienced two conditions in a within-subject study design. The order of presentation of test conditions, day of testing, and gender were balanced. Temperature, relative humidity, VRs, and concentrations of pollutants were monitored. Online surveys assessed PAQ and SBS symptoms and a validated computer-based tool measured decision-making performance. Neither changing the VR per person nor changing the VR per floor area, had consistent statistically significant effects on PAQ or SBS symptoms. However, reductions in either occupant-based VR or floor-area-based VR had a significant and independent negative impact on most decision-making measures. These results indicate that the changes in VR employed in the study influence performance of healthy young adults even when PAQ and SBS symptoms are unaffected.",Cognitive performance; Health symptoms; Perceived air quality; Ventilation,,PERFORMANCE; SIMULATION; HEALTH; OFFICE,WOS
325,10.3390/su16177491,Empowering London Primary School Communities to Know and Tackle Air Pollution Exposure,"Otu, E; Ashworth, K; Tsekleves, E; Ackley, A",2024,SUSTAINABILITY,16.0,17,"This study tested the effectiveness of participatory methods to engage primary school communities in London with air pollution issues to help them identify, understand, and reduce their air pollution exposure. Three primary schools with high pollution levels participated in environmental educational activities, including air quality workshops and field campaigns involving different methods, time schedules, and project scopes. Participants completed surveys before and after these activities to measure their understanding, perceptions, and behavior. After the workshops, students admitted feeling more skillful in monitoring air quality and confident in incorporating this education into daily life and teaching others. They shared their results with peers, school leadership, and the community and led campaigns to help design experiments, choose measurement locations, and reduce air pollution exposure in schools. The results showed increased concern about air pollution, a better understanding of its causes and impacts, and more reported reduction behaviors. An Air Pollution Exposure Index (APEI) was combined with participatory monitoring data to raise awareness and understanding among students on typical school-day exposure. Feedback indicates that the tool was useful in defining air pollution exposure status and identifying exposure risks. Overall, this study contributes to the evidence of the feasibility and impact of student-led environmental education interventions These interventions involve collecting personalized exposure data, co-planning mitigations with school community groups, and employing methods to raise awareness of air pollution and empower pupils to identify potential solutions and change behaviors.",air pollution; PM2.5; children; children's health; school environment; participatory research; air quality monitoring; environmental education; student-led interventions; pollution mitigation strategies,City of London; England; London [England]; United Kingdom; air quality; atmospheric pollution; child health; education; environmental education; participatory approach; particulate matter; pollution exposure,INDOOR AIR; YOUNG-CHILDREN; QUALITY; ENVIRONMENT; HEALTH; SCIENCE; IMPACT; POLICY; TREES; RISK,WOS
336,10.5430/JCT.V11N7P31,Encouraging Awareness among Secondary School Students on Air Pollution in Supporting Environmental Protection,Jumintono; Bin Taha M.R.,2022,,11.0,7,"Understanding the vulnerability of our environment and the significance of its protection is known as environmental awareness. Promoting environmental awareness is a simple method to protect the environment and help shape a better future for our generation. The study's aim is to look at secondary school pupils' understanding of the environment. The research used a survey method with multiple-choice questions to examine secondary pupils' environmental awareness. Five secondary schools from Sekolah Menengah Kebangsaan Datuk Sulaiman in Batu Pahat, Johor, were used as a sample for this study. These samples were selected by the researches using simple random sampling technique. There are five questions that students need to answer correctly. The data were collected and analyses using Statistic Package for Science Sciences Software (SPSS V21.0). As a result, it shows a significant difference in frequency and percentage of students gets the correct answer in the post-test. Based on the result its show positive feedback of video-based learning from the students. Hence, education through Information and Communication Technology more effective and interesting than used traditional method. © 2022 Novel Carbon Resource Sciences. All rights reserved.",air pollution; awareness; encouraging; environmental protection,,,Scopus
