,DOI,Title,Authors,Year,Source Title,Volume,Issue,Abstract,Author Keywords,Scopus Keywords,WOS Keywords,Source
34,10.1007/s12061-022-09446-2,No Country for Old Men. Assessing Socio-Spatial Relationships Between Air Quality Perceptions and Exposures in Southern Chile,"Boso, A; Martínez, A; Somos, M; Alvarez, B; Avedaño, C; Hofflinger, A",2022,APPLIED SPATIAL ANALYSIS AND POLICY,15.0,4,"An extensive body of research has been noted that many socially deprived communities tend to live in areas characterized by higher levels of outdoor air pollution. Whilst there is an expanding literature documenting this disproportionate distribution, most previous studies have taken place in the Global North, have focused with industrial or vehicle air pollution sources and have tend to ignore the complex interactions between exposures, public perceptions and social factors. In this paper, we investigate the social vulnerability to and risk perceptions of air pollution sourced from domestic heating in two Chilean cities with particularly high levels of PM2.5 during winter months. To this end, we integrate primary survey data, with geographically detailed estimates of air pollution exposures and area-level characteristics obtained from the Chilean Census. We first examine the spatial distribution of PM2.5 exposures and air quality perceptions, and subsequently explore relationships between socio-demographic characteristics, air pollution exposure, and health concerns. Our results revel evident spatial patterns of dispersion, with some neighborhoods being more polluted than others. Age and percentage of roofs in poor condition in the participant's census tract are the best predictors of PM2.5 exposure. We find no correlation between perceived and real levels of contamination. Our multivariate analysis indicates that personal perceptions of air quality are significantly associated with age, gender, family structure, and heating behaviors. Such detailed depictions provide insights into potential meaningful strategies to improve air quality and highlight the need to incorporate measures to better protect older adults.",Public perception; Air pollution; Chile; Environmental justice; PM2 5,Chile; air quality; atmospheric pollution; census; environmental justice; heating; particulate matter; perception; pollution exposure; vulnerability,ENVIRONMENTAL JUSTICE ANALYSIS; POLLUTION EXPOSURE; PUBLIC PERCEPTIONS; RISK PERCEPTION; HEALTH-RISKS; URBAN; COMMUNITY; BURDEN; EXPERIENCE; SYMPTOMS,WOS
10,10.1007/s10668-021-01730-4,Objective air quality index versus subjective perception: which has a greater impact on life satisfaction?,"Shi, XM; Li, XP; Chen, XY; Zhang, LP",2022,ENVIRONMENT DEVELOPMENT AND SUSTAINABILITY,24.0,5,"Although the PM2.5 concept was put forward in 1997, it came into Chinese people's sight in 2011, and became a household name in 2013 in China. Previous studies did not involve this indicator, so we need to re-examine and compare the effects of objective air quality data and subjective perception on Life satisfaction (LS). The data were collected from Xi'an, a megacity of Northwest China. Particles smaller than 2.5 mu m in diameter (PM2.5), nitrogen dioxide (NO2), sulfur dioxide (SO2), and Air quality index (AQI) acquired from air quality stations were used to calculate pollutant concentrations near the vicinity of subjects' home by Geographical information system (GIS) software. In this paper, the ordinal logistic regression models are used to explain ratings of LS in terms of the objective air pollution data, social and economic variables. The results indicate that the objective air pollution data has significant and negative effects on LS of the surveyed respondents. However, when the subjective perception of air pollution is considered in the regression models, it shows that the subjective perception of air pollution has a significant negative impact on LS, while the effects of PM2.5, NO2, SO2, and AQI on the LS become insignificant. Furthermore, the research significances and policy suggestions are discussed in this paper. [GRAPHICS] .",Life satisfaction; Subjective well-being; Air quality; Perception of air pollution,Air; China; Niger [West Africa]; Shaanxi; Xian; air quality; atmospheric pollution; GIS; life satisfaction; megacity; particulate matter; perception,ENVIRONMENTAL-QUALITY; MINING AREA; POLLUTION; HAPPINESS; INCOME; VALUATION; CLIMATE; HEALTH; COST,WOS
71,10.1016/j.envres.2020.110492,"Objectively measured association between air pollution and physical activity, sedentary behavior in college students in Beijing","Yu, M; Wu, Y; Gordon, SP; Cheng, JL; Chen, PP; Wang, YY; Yu, HJ",2021,ENVIRONMENTAL RESEARCH,194.0,,"The purpose of this study is to examine the association between hourly air pollution on hourly physical activity (PA) and sedentary behavior (SB) among college students in Beijing, China. The secondary aim was to examine such associations varied at specific time. A total of 340 participants were recruited from the Tsinghua University, in Beijing, China. Accelerometers provided PA measures, including moderate-to-vigorous physical activity (MVPA), walking steps, energy expenditure and sedentary time for 7 consecutive days. Corresponding air pollution data by the Beijing Municipal Ecological Environment Bureau in the closed site (Wan Liu site) in Tsinghua University were collected including average hourly air quality index (AQI) and PM2.5 (mu g/m(3)). Associations were estimated using linear individual fixed-effect regressions. We also conducted an air pollution risk perception survey among 2307 freshmen (76.6% males) who were enrolled in Tsinghua in 2016, and the survey was done in May 22-26, 2017. A one level increase in hourly air quality index (AQI) was associated with a reduction in 1-h PA by 0.083 (95% confidence interval [CI] =-0.137,-0.029) minutes of MVPA, 8.8 (95% CI =-15.0,-2.6) walking steps, 0.65 (95% CI =-1.03,-0.27) kcals of energy expenditure. A 10 mu g/m(3) increase in air pollution concentration in hourly PM2.5 was associated with a reduction in 1-h PA by 0.021 (95% confidence interval [CI] =-0.033,-0.010) minutes of MVPA, 2.2 (95% CI =-3.5,-0.9) walking steps, 0.170 (95% CI =-0.250,-0.089) kcals of energy expenditure an increase in 1-h sedentary behavior 0.045 (0.005, 0.0845). At specific time, stronger negative associations of AQI and PM2.5 air pollution with PA at 8 a.m., 4 p.m., 5 p.m. and 7 p.m. Similarly, stronger positive associations of 1 h AQI and PM2.5 air pollution with SB at 8 a.m., 9 a.m., 11 a.m., and 7 p.m. A total of 94.9% participants (n = 2235) responded yes to air pollution change activities in the survey, which may partially explain PA change. Air pollution may discourage physical activity and increases sedentary behavior among freshman students living in Beijing, China. This is preliminary study. The impact of air pollution on physical activity and sedentary behavior at a specific time may be different.",Air pollution; AQI; PM2.5; Physical activity; Sedentary behavior; Youth,,FINE PARTICULATE MATTER; AMBIENT FINE; BLOOD-PRESSURE; CARDIOVASCULAR-DISEASE; EXPOSURE; CHINA; TIME; MORTALITY; INACTIVITY; QUALITY,WOS
44,10.1016/j.buildenv.2019.05.011,Occupants’ thermal comfort and perceived air quality in natural ventilated classrooms during cold days,Liu J.; Yang X.; Jiang Q.; Qiu J.; Liu Y.,2019,,158.0,,"In north-west China, a number of university classrooms are natural ventilated during cold days when the prevailing mean outdoor air temperature is about 10 °C. This study investigated the students' thermal comfort and perceived air quality in natural ventilated university classrooms under such low outdoor temperature. 30 field-surveys were conducted in seven typical university classrooms during November 2017 in a sub-provincial city of Xi'an located in the north-west of China in the cold climate zone. A total of 992 responses from the university students ages between 17 and 22 years were received. The results showed that the thermal neutral temperature was 20.6 °C; the thermal comfort temperature range was from 19.5 to 21.8 °C; the occupants' preference temperature was 22.78 °C. The thermal dissatisfaction rate was lower than 10% when the indoor operative temperature ranges between 18.3 and 23.8 °C. The percentage of dissatisfied occupants for indoor air quality was higher than 20% in some cases and it was not related to CO2 concentration. Based on the survey results, it was found that the comfort temperature calculated by the aPMV model (China's thermal comfort model for free-running buildings)was higher than the experiment results. The occupant density affected the perceived air quality, but had no effect on thermal sensation. Moreover, the influence factors of perceived air quality including indoor temperature, enthalpy, thermal acceptability and thermal sensation were analyzed. Results showed that the occupants' acceptability of indoor air quality was mainly affected by thermal sensation. © 2019",High occupancy rate; Low outdoor temperature; Natural ventilated classroom; Perceived air quality; Thermal comfort,China; Apple mosaic virus; Air quality; Atmospheric temperature; Indoor air pollution; Space heating; Students; Surveys; Ventilation; Free running buildings; Natural ventilated classroom; Occupancy rate; Outdoor temperature; Outdoor-air temperature; Perceived air quality; Thermal acceptabilities; Thermal comfort models; air quality; climate; indoor air; temperature effect; ventilation; Thermal comfort,,Scopus
265,10.3390/atmos9070270,Online Questionnaire as a Tool to Assess Symptoms and Perceived Indoor Air Quality in a School Environment,"Järvi, K; Vornanen-Winqvist, C; Mikkola, R; Kurnitski, J; Salonen, H",2018,ATMOSPHERE,9.0,7,"School environments are a complex entirety where various different exposure factors are related that contribute to the indoor air quality (IAQ) and may affect occupants' health and well-being. Indoor air questionnaires are useful for collecting information about the occupants' experiences and perceptions of the indoor air and for evaluating the results of the measures taken. A common way to implement health questionnaires is to ask the respondents to describe symptoms at certain time points, such as weeks or months. The aim of our study was to develop a short and easy online questionnaire to assess symptoms and perceived IAQ. We also aimed to test the usability of the questionnaire in school buildings and assess the differences between the online measurement data (CO2, T, and RH) and the IAQ complaints and symptoms reported by the pupils. A total of 105 teachers and 1268 pupils in 36 classrooms at six schools answered the questionnaires over a two-week period. The participants completed the questionnaire always after the lesson in the studied classroom. We received 719 answers from the teachers and 6322 answers from the pupils. The results demonstrated that the teachers reported more IAQ problems and symptoms than the pupils did. Differences between classrooms were observed in both the IAQ problem and reference schools. The most common significant differences (p-value > 0.05) between the classrooms were among humidity, too cold air, and stuffy air, and among symptoms, dry/sore throat, tiredness, headache, and skin symptoms. Maximum values of CO2 measurements and the highest prevalence of stuffy air were relatively consistent. The testing process demonstrated that such a questionnaire was suitable for adults and children aged at least 12 years. The results of our study suggest that a quick and easy online questionnaire that is completed within a short period may be useful for gathering valuable knowledge about perceived IAQ. It could be used in combination with other indoor environment investigations to produce detailed results and restorative measures.",indoor air; health questionnaire; symptoms; pupils; teachers,,RESPIRATORY SYMPTOMS; ELEMENTARY-SCHOOLS; HEALTH SYMPTOMS; VENTILATION RATES; MOISTURE DAMAGE; CHILDREN; ASTHMA; DAMPNESS; ASSOCIATIONS; PERFORMANCE,WOS
83,10.1016/j.jadohealth.2020.07.040,"Outdoor Air Quality Awareness, Perceptions, and Behaviors Among US Children Aged 12-17 Years, 2015-2018","Lynch, KM; Mirabelli, MC",2021,JOURNAL OF ADOLESCENT HEALTH,68.0,5,"Purpose: This study aimed to assess U.S. adolescents' perceptions and knowledge about air quality and their behaviors aimed to reduce air pollution exposure and whether they vary by demographic characteristics. Methods: We analyzed data from the Porter Novelli Public Services YouthStyles survey, a nationally representative survey of U.S. adolescents aged 12-17 years. In survey years 2015-2018, a total of 3,547 adolescents self-reported awareness, perceptions, and behaviors related to air pollution. We calculated weighted percentages of respondents reporting each aspect of air quality awareness, perception, and behaviors overall and by categories of age, gender, parental education, metropolitan status, region, and survey year. Results: Overall, an estimated 81% of U.S. adolescents thought outdoor air pollution could impact health, 52% thought there were things they could do to limit their or their family's exposure, 19% were aware of air quality alerts, 46% of those who thought or were informed air quality was bad did something differently, and 19% always or usually avoided busy roads to reduce air pollution exposure; differences were reported by some demographic variables. Conclusions: Among U.S. adolescents, awareness that air pollution could impact health was relatively high. However, gaps were found in the awareness of the potential impacts and other aspects of awareness and perceptions related to air pollution and the engagement in behaviors to reduce exposure, some of which varied by demographic characteristics. These results can be used to inform interventions that increase awareness and behaviors to reduce air pollution exposures among U.S. adolescents. Published by Elsevier Inc. on behalf of Society for Adolescent Health and Medicine.",Air pollution; Air quality alerts; Health education; Behavior change; Avoidance behaviors; Adolescents; Teenagers; Environmental health; Environmental exposure; Physical activity,,PARTICULATE MATTER; POLLUTION; HEALTH; EXPOSURE; RISK,WOS
23,10.1007/s11356-018-3715-2,Outdoor air pollution pregnancy exposures are associated with behavioral problems in China's preschoolers,"Ren, YZ; Yao, X; Liu, YS; Liu, SY; Li, X; Huang, Q; Liu, FF; Li, N; Lu, YN; Yuan, ZP; Li, SY; Xiang, H",2019,ENVIRONMENTAL SCIENCE AND POLLUTION RESEARCH,26.0,3,"There are mounting evidences indicated that maternal exposure to outdoor air pollutants in pregnancy affects children's neural development, but the researches on children's behavioral difficulties are seldom. We explored the association between maternal exposure to outdoor air pollution during different trimesters of pregnancy and the prevalence of behavioral difficulties among 657 preschool children aged 3-4 from three kindergartens in Wuhan, China. This is a cross-sectional study. Children's behavioral difficulties were assessed by the Strengths and Difficulties Questionnaire (SDQ) (reported by parents). Maternal exposure to outdoor air pollutants during pregnancy were estimated based on the daily average measured concentration levels from ground monitoring stations. Potential confounding factors including children-related, maternal, and socio-economic status (SES) were adjusted in the study. We calculated the prevalence of each type of behavioral difficulties and used binary logistic regression method to estimate the crude odds ratio (cOR), adjusted odds ratio (aOR), and corresponding 95% confidence intervals (95% CIs) for 1g/m(3) increase in each air pollutant during every exposure window in single- and two-pollutant models. The prevalence of participants' total behavioral difficulties was 9.6%. In single-pollutant models, during full gestation, positive associations were observed between exposure to NO2 (aOR=1.204, 95% CI 1.042, 1.392), particle matter (PM)(10) (aOR=1.070, 95% CI 1.018, 1.125), PM2.5 (aOR=1.095, 95% CI 1.021, 1.176) and total difficulties, exposure to PM10 (aOR=1.040, 95% CI 1.001, 1.081), PM2.5 (aOR=1.053, 95% CI 1.000, 1.109) and prosocial behavior, respectively. In the first trimester, exposure to SO2 (aOR=1.047, 95% CI 1.009, 1.086), NO2 (aOR=1.039, 95% CI 1.013, 1.066), PM10 (aOR=1.013, 95% CI 1.004, 1.023), and PM2.5 (aOR=1.016, 95% CI 1.004, 1.028) were all positively associated with total difficulties. The associations between second and third trimesters' exposure to all pollutants and outcomes were not statistically significant. However, in the two-pollutant models, second trimester exposure to PM2.5 (aOR=1.078, 95%CI 1.023, 1.137) was positively associated with total behavioral difficulties after adjusting for PM10. Exposure to outdoor air pollutants SO2, NO2, PM10, and PM2.5 during pregnancy may be associated with behavioral difficulties, especially in the first trimester.",Air pollution; Behavioral difficulties; Pregnancy; China,,DIFFICULTIES QUESTIONNAIRE SDQ; CHILDHOOD EXECUTIVE FUNCTION; CHILDREN; STRENGTHS; RISK; HYPERACTIVITY; MICROGLIA; LIFE; AGE; NEURODEVELOPMENT,WOS
343,,PASSING THE TEST - HUMAN-BEHAVIOR AND CALIFORNIA SMOG CHECK PROGRAM,"LAWSON, DR",1993,JOURNAL OF THE AIR & WASTE MANAGEMENT ASSOCIATION,43.0,12,"We have analyzed data obtained from more than 11,000 vehicles inspected in California's random roadside surveys to assess the real-world characteristics of the in-use motor vehicle fleet and to test the effectiveness of California's inspection and maintenance (I/M) program. The low-idle emissions data from these surveys show that 10 percent of the fleet are responsible for about 60 percent of the exhaust hydrocarbons and also that 10 percent of the fleet (not necessarily the same vehicles) are responsible for about 60 percent of the carbon monoxide emissions. We also show that high emitters appear among all model years, and not just among old vehicles, as previously assumed. Old vehicles, on average, have higher idle emissions than new vehicles, but they contribute relatively little to the total idle emissions because there are so few on the road. We compare roadside survey results at I/M and non-I/M locations in California, and observe identical tampering and overall failure rates at the two types of locations. We also show that motorists are taking steps to ''pass the test,'' and that the high-emitting vehicles' idle-emissions performance and tampering rates in the roadside surveys are unaffected by the Smog Check test. These results imply that success in California's Smog Check program in reducing emissions will require consideration of human behavior and the attendant negative incentives inherent in the program as historically conceived. EPA's national tampering surveys also show little difference in tampering rates among areas with decentralized, centralized and no I/M programs. We therefore propose that an I/M 'shootout'' be conducted to evaluate candidate programs for the next generation of I/M programs in the United States.",,,EMISSIONS; VEHICLES,WOS
202,10.1142/S0217590817410028,POLICY CHOICES FOR AIR POLLUTION ABATEMENT IN BEIJING: STATUS QUO OR CHANGE,"Zhou, SJ; Yu, XH; Koemle, D",2020,SINGAPORE ECONOMIC REVIEW,65.0,3,"In order to control air pollution in Beijing, China has introduced a number of policy measures. However, the policy costs have never been well evaluated from the perspective of the residents. We conducted a survey of 633 Beijing residents with a choice experimental setting, and evaluate the current air pollution control policies. The main findings include: (1) Restriction of private vehicle driving does increase utility of residents; (2) Replacing coal-dominated heating system with natural gas has a better effect on air pollution control than replacement with electricity; (3) Beijing residents demand more radical policies to control air pollution and, according to our estimation, are willing to pay 5.1% of their income for more such policy measures; (4) The capital city function of Beijing yields many economic and political advantages for the residents, and the economic benefit is equal to 8.3% of their income.",Beijing city; air pollution; choice experiment; status quo; policy choices,,WILLINGNESS-TO-PAY; CONTINGENT VALUATION; ASSOCIATION; EXPOSURE; QUALITY; PM2.5,WOS
344,,PRE-SERVICE SCIENCE TEACHERS' KNOWLEDGE LEVEL ABOUT SOME BASIC AIR POLLUTANTS,"Cibik, AS; Darcin, ES",2009,JOURNAL OF BALTIC SCIENCE EDUCATION,8.0,1,"The aim of this study was to investigate the Turkish pre-service science teachers' level of knowledge about air pollution. The participants' levels of knowledge about Air Pollution were identified via a closed form questionnaire. The measuring instrument is applied on 325 female and 137 male students inside of the sample and a total of 462 students was applied this test. The questionnaire using in this study consisted of 17 statements. The results of the study revealed that, even though Turkish pre-service science teachers' level of knowledge about air pollution were well shaped, it is shown that most of these pre-service science teachers have misconception. The results show that they did not hove adequate knowledge (level) about some basic air pollutants and their effects. The results also revealed that pre-service teachers have misconceptions about whether the pollutants CFCs, CO2 and Hydrocarbons are pollutants or not. In order to prevent that, pre-service teachers should be informed about the effects and activities of these pollutants and what should be done.",pre-service science teachers; misconception; air pollution,,ENVIRONMENTAL KNOWLEDGE; OZONE-LAYER; CHILDRENS,WOS
65,10.1016/j.enpol.2019.03.038,"Participation in a programme for assisted replacement of wood-burning stoves in Chile: The role of sociodemographic factors, evaluation of air quality and risk perception","Boso, A; Oltra, C; Hofflinger, A",2019,ENERGY POLICY,129.0,,"Temuco and Padre Las Casas are two of the most polluted cities in southern Chile; around 90% of the particulate matter emissions are produced by wood-burning stoves used for domestic heating and cooking. Surveys were collected from 489 residents to examine differences between applicants and non-applicants to a programme to replace wood-burning stoves with pellet stoves. Results show that participants who applied to the programme are, on average, older than non-applicants, are more likely to have a respiratory impairment, tend to evaluate indoor air quality worse than non-applicants and tend to perceive the health effects of air pollution as more severe. The findings also suggest that motivation to improve air quality is a key aspect for understanding the adoption of pellet stoves when the requirement for initial investment is removed. Practical implications relating to the role of sociodemographic and psychological factors in the decision to replace heating systems are discussed to support the design of more effective interventions to mitigate wood smoke pollution.",Adoption of heating system; Wood pellets; Biomass; Risk perception; Air quality,,HEALTH BELIEF MODEL; POLLUTION; EFFICIENCY; BIOMASS; PELLETS; FUEL,WOS
175,10.1080/23748834.2024.2390274,Particulate matter pollution in central Bangkok: assessing outdoor workers’ perceptions and exposure,Archer D.; Bhatpuria D.; Nikam J.; Taneepanichskul N.,2024,,,,"Air pollution is estimated to cause 32,300 deaths annually in Thailand, with PM2.5 exposure accounting for much of this. However, not everyone bears the burden of exposure to air pollution equally, and outdoor workers are particularly exposed. In this study, we sought to better understand how local residents and outdoor workers in central Bangkok experience air pollution in their day-to-day life, through a survey of their symptoms and mitigation measures. Respondents were aware of the risks of air pollution but felt there was little they could do about their exposure to it. We also asked a subset of respondents to carry a portable PM2.5 sensor during their working day, to assess which occupations and locations faced highest pollution exposure. We found that all workers, including those who didn’t always work outdoors, faced exposure that exceeded both the WHO and Thailand 24-hour PM2.5 standards, at 43.94 μg/m3 on average. These findings demonstrate that workers face harmful levels of daily exposure and should be provided with appropriate mitigating measures by their employers to limit their exposure, and targeted health screenings. At a city and national scale, concrete action is needed to reduce sources of pollution. © 2024 The Author(s). Published by Informa UK Limited, trading as Taylor & Francis Group.",Air pollution; Bangkok; informal labour; particulate matter; Thailand,,,Scopus
